;
A aproximação com o Leste Europeu teve caráter sobretudo econômico e instrumental.;Certo
O comércio com o bloco socialista tornou-se central para a economia brasileira.;Errado
A visita de Dean Acheson ao Brasil reconheceu implicitamente a importância estratégica do país.;Certo
A política petrolífera gerou consenso nacional desde o início.;Errado
A Campanha “O Petróleo é Nosso” teve forte mobilização popular e impacto político.;Certo
Em 1953, a situação interna e externa agravou os limites da autonomia diplomática de Vargas.;Certo
A eleição de Eisenhower facilitou a barganha diplomática brasileira.;Errado
O governo Eisenhower extinguiu a Comissão Mista Brasil-EUA.;Certo
A criação da Petrobras reforçou tensões com os Estados Unidos.;Certo
A polarização entre nacionalismo e entreguismo marcou o debate político de 1953.;Certo
Vargas realizou uma inflexão, e não uma ruptura, em sua política externa em 1953.;Certo
A reforma ministerial de 1953 buscou fortalecer o controle político do presidente.;Certo
A criação da Eletrobrás e o Plano de Valorização da Amazônia integraram a agenda nacionalista.;Certo
A Instrução 70 da Sumoc introduziu leilões cambiais e taxas múltiplas.;Certo
As medidas nacionalistas de 1953 tinham também função de reforçar a barganha com os EUA.;Certo
;
;
;
Vargas buscou ampliar a autonomia diplomática e a projeção internacional do Brasil.;Certo
A radicalização da política externa varguista ultrapassou amplamente o plano discursivo.;Errado
O discurso diplomático passou a valorizar mais temas como desenvolvimento e comércio exterior.;Certo
As organizações multilaterais ganharam menor importância na política externa do período.;Errado
A política externa passou a ser influenciada por grupos fora do aparelho estatal.;Certo
O governo Vargas percebia um equilíbrio estratégico entre os blocos soviético e americano.;Certo
O fim da Guerra da Coreia influenciou a leitura diplomática brasileira.;Certo
Vargas manteve oposição explícita às lutas de libertação do Terceiro Mundo.;Errado
O discurso contra o imperialismo e o colonialismo ganhou espaço na diplomacia brasileira.;Certo
A ampliação dos horizontes diplomáticos teve caráter mais retórico que prático.;Certo
A política para a América Latina manteve-se inalterada ao longo do segundo governo Vargas.;Errado
O discurso varguista passou a criticar o descaso dos EUA com a América Latina.;Certo
A aproximação com países latino-americanos tinha função comercial e de barganha.;Certo
O Pacto ABC representou um movimento diplomático relevante e controverso.;Certo
O Brasil buscava confrontar diretamente os Estados Unidos com o Pacto ABC.;Errado
A questão do Pacto ABC contribuiu para o pedido de impeachment de Vargas.;Certo
As pressões americanas influenciaram negativamente o preço do café brasileiro.;Certo
Os EUA apoiaram integralmente as políticas cambiais nacionalistas de Vargas.;Errado
O projeto do mercado livre de câmbio atendeu a pressões norte-americanas.;Certo
A visita de Acheson ao Brasil ocorreu sem objetivos econômicos concretos.;Errado
Antes do suicídio de Vargas, os EUA sinalizaram apoio político a Café Filho.;Certo
O anúncio de um plano de ajuda à América Latina ocorreu após o suicídio de Vargas.;Errado
A Carta-Testamento denunciou explicitamente os interesses estrangeiros.;Certo
As manifestações populares após o suicídio tiveram forte caráter antiamericano.;Certo
O impacto político do suicídio resultou em uma política externa antiamericana duradoura.;Errado
O nacionalismo varguista pode ser definido como anticapitalista.;Errado
A ideologia varguista era essencialmente nacional-desenvolvimentista.;Certo
A Guerra Fria limitava as opções da diplomacia brasileira.;Certo
Vargas buscava romper com o capitalismo internacional.;Errado
O discurso anti-imperialista intensificava-se quando faltavam investimentos externos.;Certo
A política externa visava eliminar a dependência econômica externa.;Errado
O suicídio de Vargas foi seguido por um avanço do nacionalismo na política externa.;Errado
O governo Café Filho representou um retrocesso conservador na diplomacia.;Certo
Raul Fernandes simbolizava continuidade do alinhamento aos EUA.;Certo
Eugênio Gudin defendia posições econômicas liberais extremadas.;Certo
O novo governo recebeu apoio favorável da imprensa internacional.;Certo
Gudin criticou o nacionalismo como obstáculo ao desenvolvimento.;Certo
O governo Café Filho fortaleceu a Petrobras frente ao capital estrangeiro.;Errado
A política atômica brasileira tornou-se mais autônoma no governo Café Filho.;Errado
O acordo nuclear de 1955 reforçou a dependência em relação aos EUA.;Certo
A Instrução 113 da Sumoc favoreceu a evasão de capital estrangeiro.;Certo
A revogação da Instrução 70 manteve o controle cambial varguista.;Errado
A política econômica de Café Filho favoreceu a internacionalização da economia brasileira.;Certo
;
;
O governo manteve alta receptividade às propostas comerciais do Leste Europeu.;Errado
As tentativas de aproximação com o Terceiro Mundo foram estimuladas pelo governo.;Errado
O alinhamento automático aos EUA limitou a aproximação com a América Latina.;Certo
Juscelino Kubitschek foi eleito presidente em 1955 pela coligação PSD-PTB.;Certo
A posse de JK ocorreu sem tensões políticas relevantes.;Errado
Henrique Teixeira Lott teve papel decisivo para garantir a posse de JK.;Certo
O período pós-Vargas foi marcado por retrocesso desenvolvimentista e realinhamento aos EUA.;Certo
A doutrina da ESG articulava segurança e desenvolvimento.;Certo
Antes de 1964, a ESG possuía um conceito aprofundado e detalhado de desenvolvimento.;Errado
A ESG associava anticomunismo ao liberalismo econômico.;Certo
Os chamados “entreguistas” se viam como antipatrióticos.;Errado
A visão entreguista via a subordinação aos EUA como estratégia de segurança.;Certo
Golbery defendia que os EUA aceitariam um foco comunista na América do Sul.;Errado
O governo JK manteve integral autonomia diplomática frente aos Estados Unidos.;Errado
O desenvolvimentismo de JK baseava-se na associação com o capital estrangeiro.;Certo
Entre 1954 e 1958 houve retrocesso da barganha diplomática com os EUA.;Certo
A Operação Pan-Americana foi lançada em 1958.;Certo
A OPA representou uma retomada da barganha nacionalista.;Certo
O avanço da descolonização afro-asiática alterou o cenário internacional.;Certo
O Terceiro Mundo já era plenamente articulado e influente nos anos 1950.;Errado
A Europa Ocidental avançou na integração econômica nos anos 1950.;Certo
O Tratado de Roma criou a Comunidade Econômica Europeia em 1957.;Certo
O campo socialista apresentava crescimento e estabilidade nos anos 1950.;Certo
Kruschov defendeu a coexistência pacífica e a transição pacífica ao socialismo.;Certo
A conjuntura internacional caminhava para maior tensão militar direta.;Errado
O Brasil vivia estabilidade social no início do governo JK.;Errado
O conflito entre nacionalistas e entreguistas extrapolou a política externa.;Certo
O Plano de Metas priorizava bens de consumo sofisticados.;Certo
O projeto econômico de JK dispensava capital estrangeiro.;Errado
O nacional-desenvolvimentismo de JK era essencialmente associado.;Certo
O alinhamento estratégico aos EUA marcou a política externa inicial de JK.;Certo
A queda das exportações estimulou a busca por capital estrangeiro.;Certo
Apenas empresas norte-americanas investiram no setor automobilístico brasileiro.;Errado
O Brasil aproximou-se dos movimentos de libertação do Terceiro Mundo sob JK.;Errado
As relações comerciais com o bloco socialista se intensificaram.;Errado
O Brasil enviou tropas a Suez sob a bandeira da ONU.;Certo
O acordo Átomos para a Paz foi abandonado no governo JK.;Errado
A Doutrina Eisenhower visava conter o nacionalismo e o esquerdismo no Terceiro Mundo.;Certo
A instalação da base em Fernando de Noronha ocorreu sem controvérsias.;Errado
O período 1954–1958 foi um hiato de autonomia diplomática brasileira.;Certo
A política externa voltou a priorizar o desenvolvimento apenas após 1958.;Certo
;
;
;
;
A partir de 1958, JK retomou uma política externa ativa de barganha com os Estados Unidos.;Certo
O fim do crescimento acelerado de 1956–1957 influenciou a mudança diplomática de JK.;Certo
A Revolução Cubana foi irrelevante para a inflexão da política externa brasileira.;Errado
A criação da Comunidade Econômica Europeia afetou negativamente o comércio brasileiro.;Certo
A OPA marcou um ponto de inflexão na política externa de JK.;Certo
A política externa voltou a ser instrumento do desenvolvimento nacional após 1958.;Certo
O governo JK rompeu completamente os limites do alinhamento com os EUA após a OPA.;Errado
A desaceleração econômica iniciou-se em 1958.;Certo
O crescimento do PNB manteve-se elevado após 1958.;Errado
As greves se intensificaram no contexto da desaceleração econômica.;Certo
O endividamento externo agravou-se com a queda das exportações.;Certo
O setor cafeeiro foi um dos mais afetados pela crise das exportações.;Certo
A adoção integral das recomendações do FMI fortaleceria politicamente o governo JK.;Errado
JK enfrentou o dilema entre estabilização e desenvolvimento.;Certo
A inflação decorreu principalmente do Plano de Metas e dos gastos públicos.;Certo
A redução de salários e crédito preservaria a coalizão PSD-PTB.;Errado
A UDN apoiou amplamente a política econômica de JK.;Errado
O governo sofreu críticas tanto de sindicatos quanto de exportadores.;Certo
JK respondeu à crise interna com reforma ministerial.;Certo
Lucas Lopes assumiu o Ministério da Fazenda em 1958.;Certo
O Plano de Estabilização Monetária abandonou o financiamento inflacionário.;Errado
O governo adiou soluções saneadoras mais duras para o futuro.;Certo
A postura nacionalista também tinha finalidade política doméstica.;Certo
O Mercado Comum Europeu dificultou o acesso de produtos brasileiros.;Certo
As colônias africanas europeias passaram a competir com vantagem no mercado europeu.;Certo
A ampliação do comércio externo tornou-se prioridade do governo.;Certo
Macedo Soares permaneceu chanceler após julho de 1958.;Errado
Francisco Negrão de Lima assumiu o Itamaraty em 1958.;Certo
A América Latina tornou-se prioridade diplomática após a reforma ministerial.;Certo
Os países socialistas passaram a receber alguma atenção diplomática.;Certo
A OPA teve impacto limitado e foi objeto de avaliações divergentes.;Certo
O BID foi apontado como um dos resultados associados à OPA.;Certo
A ALALC não teve qualquer relação com a OPA.;Errado
Os EUA aceitaram plenamente uma inserção autônoma do Brasil no sistema interamericano.;Errado
As relações hemisféricas melhoraram significativamente no segundo mandato Eisenhower.;Errado
O descontentamento latino-americano com os EUA aumentou nos anos 1950.;Certo
Nixon enfrentou manifestações hostis em sua viagem à América do Sul em 1958.;Certo
Os protestos contra Nixon revelaram o mal-estar regional com os EUA.;Certo
A política externa soviética no Terceiro Mundo tornou-se mais ativa.;Certo
O XX Congresso do PCUS defendeu a transição pacífica ao socialismo.;Certo
O lançamento do Sputnik reforçou o prestígio internacional soviético.;Certo
A competição EUA–URSS passou a se manifestar também na América Latina.;Certo
A política externa era irrelevante para enfrentar a crise interna de JK.;Errado
A OPA começou com uma carta de JK a Eisenhower em maio de 1958.;Certo
JK expressou solidariedade aos EUA após os incidentes com Nixon.;Certo
A carta de JK negava qualquer prejuízo à unidade pan-americana.;Errado
;
JK defendia que o Brasil já havia alcançado um nível de desenvolvimento que exigia maior voz internacional.;Certo
JK aceitava passivamente o alinhamento automático com os EUA por razões geográficas.;Errado
JK enfatizou a necessidade de unidade latino-americana para a estabilidade regional.;Certo
O Plano Marshall priorizou igualmente a reconstrução europeia e o desenvolvimento latino-americano.;Errado
JK considerava o subdesenvolvimento latino-americano um fator de vulnerabilidade do Ocidente.;Certo
A OPA defendia maior investimento nas áreas economicamente atrasadas do continente.;Certo
A OPA rejeitava programas de assistência técnica internacional.;Errado
JK defendia a proteção dos preços dos produtos primários contra flutuações excessivas.;Certo
A atualização dos organismos financeiros internacionais era parte das propostas da OPA.;Certo
A reação inicial dos Estados Unidos à OPA foi entusiástica.;Errado
John Foster Dulles apresentou a JK uma proposta focada no combate ao comunismo.;Certo
A minuta de Dulles incluía financiamento à Petrobras.;Errado
JK aceitou a minuta apresentada por Dulles sem objeções.;Errado
Os EUA reconheceram posteriormente os princípios da OPA.;Certo
O BID foi criado como desdobramento da OPA.;Certo
A ALALC foi cogitada como parte das iniciativas associadas à OPA.;Certo
O Comitê dos 21 foi criado no âmbito da OEA para tratar da OPA.;Certo
Houve um clima inicial de euforia após o lançamento da OPA.;Certo
A OPA tinha apenas objetivos simbólicos, sem relação com interesses econômicos.;Errado
JK defendeu o restabelecimento de relações comerciais com a União Soviética em 1958.;Certo
O Itamaraty criou uma comissão para estudar a reaproximação com o campo socialista.;Certo
A aproximação com o bloco socialista visava fortalecer a barganha com os EUA.;Certo
Os meios empresariais rejeitavam qualquer comércio com países socialistas.;Errado
JK só buscava a aproximação com o campo socialista após a recusa dos EUA.;Certo
O PCB apoiava a reaproximação com a União Soviética.;Certo
A reaproximação com a URSS foi aceita sem resistências internas.;Errado
Setores conservadores do Exército e da Igreja opuseram-se à reaproximação.;Certo
As Ligas Camponesas contribuíram para a politização da política externa.;Certo
A eleição de Leonel Brizola acirrou o debate sobre nacionalismo.;Certo
O governo JK reduziu a presença de capital estrangeiro na economia.;Errado
A sociedade brasileira passou por um processo de americanização cultural.;Certo
A política externa de JK após 1958 teve também dimensão multilateral.;Certo
O Brasil apoiou explicitamente movimentos de libertação das colônias portuguesas.;Errado
O reconhecimento de novos Estados afro-asiáticos respeitou as posições das ex-metrópoles.;Certo
O Brasil abriu representações diplomáticas na Ásia e na África.;Certo
O governo JK rompeu relações com a África do Sul após Sharpeville.;Errado
A sucessão presidencial intensificou os conflitos em política externa.;Certo
A UDN lançou a candidatura de Jânio Quadros.;Certo
João Goulart e Brizola criticavam os lucros das empresas estrangeiras.;Certo
JK rompeu com o FMI em junho de 1959.;Certo
O rompimento com o FMI teve forte apoio interno.;Certo
Os EUA reagiram positivamente aos créditos solicitados pelo Brasil após o rompimento.;Errado
JK afastou os “entreguistas” da área econômica após 1959.;Certo
Horácio Lafer foi nomeado chanceler em 1959.;Certo
A Revolução Cubana reforçou a ideia de que pobreza gerava subversão.;Certo
Os EUA responderam à Revolução Cubana com maior flexibilidade política.;Errado
A OPA entrou em processo de esgotamento após 1959.;Certo
Os EUA buscaram isolar Cuba na V Reunião de Consulta de 1959.;Certo
Jânio Quadros manteve uma postura internacional ambígua antes de ser eleito.;Certo
Eisenhower visitou o Brasil em 1960.;Certo
A Declaração de Brasília indicou mudança no discurso diplomático dos EUA.;Certo
O Fundo de Progresso Social foi criado após negociações de Eisenhower.;Certo
As encampações no RS não tinham relação com problemas estruturais.;Errado
As empresas estrangeiras investiam amplamente na melhoria dos serviços públicos.;Errado
A política externa nacionalista de JK foi mera improvisação conjuntural.;Errado
;
;
;
O ISEB foi fundado em 1955, dando continuidade a tradições nacionalistas anteriores.;Certo
O ISEB defendia a aliança entre a burguesia nacional e os setores populares.;Certo
O movimento editorial do ISEB era apoiado pelo Ministério da Educação.;Certo
Hélio Jaguaribe foi um dos principais intelectuais do ISEB.;Certo
Para Jaguaribe, o nacionalismo tinha origem principalmente em fatores militares.;Errado
JK defendia um nacionalismo fundamentado no desenvolvimento econômico.;Certo
Jaguaribe defendia maior autonomia do Brasil frente aos Estados Unidos.;Certo
A política externa era vista como dissociada do desenvolvimento econômico-social.;Errado
Jaguaribe considerava o Itamaraty plenamente preparado para novas demandas.;Errado
A OPA elevou o perfil internacional do Brasil, apesar de suas limitações.;Certo
A OPA concentrou-se exclusivamente em relações com a Europa.;Errado
A política externa de JK mudou de forma perceptível no final de seu governo.;Certo
O aprofundamento dessa mudança só ocorreu com a Política Externa Independente.;Certo
JK possuía amplo apoio político para aprofundar a mudança diplomática.;Errado
A PEI tinha como objetivo central o desenvolvimento nacional.;Certo
Política externa para o desenvolvimento significava buscar meios externos para expandir a economia.;Certo
A PEI identificava o Brasil como protagonista no conflito Norte-Sul.;Certo
A eleição de Jânio Quadros demonstra relação linear entre política interna e externa.;Errado
Jânio Quadros e Afonso Arinos eram politicamente conservadores.;Certo
Governos conservadores tendem a ter menor margem de manobra diplomática.;Errado
A PEI inspirou-se, entre outros fatores, no nacionalismo de Charles de Gaulle.;Certo
Jânio Quadros manteve alinhamento automático com os Estados Unidos.;Errado
Jânio Quadros recusou-se a romper relações com Cuba.;Certo
O governo Jânio reatou relações com países do Leste Europeu.;Certo
Quadros buscou aproximação com Portugal salazarista.;Errado
O governo Jânio apoiou as independências de Angola e Moçambique.;Certo
Quadros criticou o apartheid sul-africano.;Certo
O Brasil apoiou a invasão da Baía dos Porcos.;Errado
A política econômica de Jânio alinhou-se ao FMI.;Certo
A política externa funcionava como compensação ao conservadorismo interno.;Certo
O desenvolvimento brasileiro dependia exclusivamente dos EUA.;Errado
A PEI ampliou a polarização política interna.;Certo
A PEI foi vista por alguns como voluntarismo inconsequente.;Certo
A PEI marcou uma inflexão rumo a uma política externa mundial e multilateral.;Certo
Antes da PEI, a política externa brasileira era predominantemente europeia até o século XIX.;Certo
No século XX, prevaleceu a lógica hemisférica e a aliança com os EUA.;Certo
Nos anos 1950, houve polarização entre americanismo e neutralismo.;Certo
Golbery do Couto e Silva associava-se à corrente neutralista.;Errado
O ISEB inspirava a corrente nacionalista.;Certo
A industrialização exigiu a ruptura dos limites tradicionais da política externa.;Certo
A OPA prenunciou a mudança que seria consolidada pela PEI.;Certo
Em 1961, a economia brasileira atravessava grave crise.;Certo
Os preços dos produtos primários exportados estavam em alta em 1961.;Errado
A complementaridade entre Brasil e EUA entrou em declínio.;Certo
A saída de capitais superava o ingresso no início dos anos 1960.;Certo
A urbanização alterou profundamente o perfil da sociedade brasileira.;Certo
A política externa passou a ocupar lugar central no debate político nacional.;Certo
A descolonização ampliou o número de Estados no sistema internacional.;Certo
O Movimento dos Não Alinhados expressou a emergência do Terceiro Mundo.;Certo
O campo socialista consolidou-se como alternativa no sistema mundial.;Certo
A Revolução Cubana impactou profundamente a política hemisférica.;Certo
A PEI foi formalizada por Jânio Quadros e Afonso Arinos.;Certo
San Tiago Dantas aprofundou conceitualmente a PEI.;Certo
Jânio Quadros manteve posturas diplomáticas tradicionais e discretas.;Errado
A PEI defendia a coexistência pacífica e o desarmamento.;Certo
A PEI apoiava a intervenção em assuntos internos de outros países.;Errado
A autodeterminação dos povos era um princípio da PEI.;Certo
A PEI apoiava a emancipação de territórios não autônomos.;Certo
A PEI defendia autonomia nos projetos de desenvolvimento econômico.;Certo
A ampliação do comércio com países socialistas fazia parte da PEI.;Certo
;
;
A PEI retomava taticamente linhas básicas da Operação Pan-Americana em conjuntura mais favorável.;Certo
A PEI buscava manter a política externa restrita ao subsistema regional latino-americano.;Errado
O nacionalismo foi utilizado pela PEI como instrumento ideológico de apoio à industrialização.;Certo
A política externa como instrumento do desenvolvimento já havia sido esboçada nos anos 1950 e amadureceu com a PEI.;Certo
Jânio Quadros apresentou a PEI como uma forma clássica de neutralismo e não alinhamento.;Errado
Para Jânio Quadros, a PEI caracterizava-se pela independência em relação aos blocos e relações econômicas com todos os Estados.;Certo
A diplomacia heterodoxa de Jânio Quadros foi acompanhada por uma política econômica interna igualmente heterodoxa.;Errado
O programa de austeridade do governo Quadros recebeu apoio do FMI.;Certo
O Itamaraty foi reformado durante o governo Quadros, com criação de setores voltados à África e ao Leste Europeu.;Certo
O governo Quadros manteve distância do campo socialista e evitou contatos diplomáticos com a URSS.;Errado
O Brasil apoiou a inclusão da República Popular da China na ONU durante o governo Quadros.;Certo
A condecoração de Iuri Gagarin simbolizou a aproximação brasileira com a União Soviética.;Certo
A política externa de Quadros em relação ao socialismo enfrentou oposição dos grupos conservadores.;Certo
O governo Quadros manteve apoio irrestrito a Portugal e ao colonialismo africano.;Errado
O apoio à descolonização africana tinha também objetivos econômicos para o Brasil.;Certo
O Brasil criou diversas embaixadas e consulados no mundo afro-asiático durante a PEI.;Certo
A participação brasileira em conferências neutralistas representou continuidade absoluta da política externa tradicional.;Errado
A Aliança para o Progresso esvaziou politicamente a Operação Pan-Americana.;Certo
O Brasil defendeu a intervenção externa em Cuba após a Revolução Cubana.;Errado
O Tratado de Uruguaiana buscou aproximação política e econômica entre Brasil e Argentina.;Certo
A condecoração de Che Guevara expressou alinhamento automático do Brasil ao socialismo.;Errado
Jânio Quadros renunciou esperando obter poderes excepcionais.;Certo
O Movimento da Legalidade garantiu a posse de João Goulart.;Certo
O parlamentarismo limitou os poderes de João Goulart após sua posse.;Certo
San Tiago Dantas levou a PEI ao seu auge durante o período parlamentarista.;Certo
O Brasil votou a favor da expulsão de Cuba da OEA em Punta del Este.;Errado
A lei de limitação da remessa de lucros agravou as relações Brasil–EUA.;Certo
O FMI manteve apoio financeiro contínuo ao governo Goulart.;Errado
O Brasil condenou implicitamente a política nuclear dos Estados Unidos em fóruns internacionais.;Certo
A Crise dos Mísseis de 1962 fortaleceu a posição diplomática da PEI.;Errado
A ingerência americana na política interna brasileira intensificou-se no governo Goulart.;Certo
O Acordo Militar Brasil–EUA foi renovado pouco antes do golpe de 1964.;Certo
A deposição de Goulart resultou em alinhamento imediato da política externa brasileira a Washington.;Certo
A PEI jamais influenciou políticas externas posteriores dos governos militares.;Errado
A PEI pode ser interpretada a partir de abordagens diplomáticas, econômicas e sociológicas.;Certo
As diferentes interpretações da PEI são mutuamente excludentes.;Errado
A PEI constituiu um projeto coerente de transformação da inserção internacional do Brasil.;Certo
Antes da PEI, a política externa brasileira era majoritariamente reflexo da posição internacional do país.;Certo
A política externa para o desenvolvimento tornou-se instrumento central do projeto de industrialização brasileira nos anos 1960.;Certo
;
;
;
O projeto nacional de desenvolvimento constitui o elemento dinâmico central da PEI.;Certo
O nacionalismo da PEI não possuía relação direta com um projeto de desenvolvimento.;Errado
As tensões e contradições marcaram todos os governos entre 1951 e 1964, especialmente no fracasso da PEI.;Certo
A PEI esteve desvinculada das necessidades do projeto de industrialização por substituição de importações.;Errado
A orientação diplomática que culminou na PEI decorreu apenas de fatores externos.;Errado
Fenômenos internos de natureza econômico-social e político-ideológica influenciaram a PEI.;Certo
Os anos 1950 marcaram a emergência de setores populares e classes médias em uma sociedade urbanizada.;Certo
O nacionalismo tornou-se ideologia oficial do populismo brasileiro a partir de 1951.;Certo
O nacionalismo reforçou a legitimidade do Estado como representante dos interesses coletivos.;Certo
Houve convergência de interesses entre o operariado e a burguesia nacional no período.;Certo
O desenvolvimento industrial brasileiro não entrou em choque com os interesses da potência hegemônica.;Errado
As tensões com os Estados Unidos se intensificavam nos momentos de crise econômica externa.;Certo
Antes da Revolução Cubana, a política dos EUA para a América Latina era percebida como de descaso.;Certo
O descaso norte-americano caracterizava-se pela ausência de investimentos em infraestrutura.;Certo
