Qual país era chave para o apoio à OPA na América Latina?;A Argentina, para garantir legitimidade e contornar receios regionais sobre hegemonia brasileira.
Por que o apoio formal da Argentina à OPA foi discreto?;Frondizi temia perder apoio dos EUA e havia disputa Brasil-Argentina por preferência junto aos EUA.
O que a OPA contribuiu para as relações Brasil-Argentina?;Aproximação política e cooperação que culminou no Convênio de Amizade e Consulta entre JK e Frondizi.
Quem foi Augusto Schmidt e qual seu papel na OPA?;Empresário e assessor de JK, idealizou a OPA e teve papel decisivo na sua formulação e divulgação.
Qual foi a reação inicial do Itamaraty à proposta da OPA?;Resistência, em parte devido a diferenças pessoais entre Schmidt e o chefe do Departamento Político do Itamaraty.
Qual a visão de Augusto Schmidt sobre o desenvolvimento do Brasil?;Dependeria de um grupo restrito de homens, recursos nacionais e auxílio externo para superar desafios coloniais.
Qual documento marcou o lançamento oficial da OPA?;O Discurso de JK à Nação e aos Representantes Diplomáticos dos Estados Americanos, em 20 de junho de 1958.
O que JK criticou nesse discurso?;A postura passiva do Brasil no cenário internacional e o alinhamento automático com a política dos EUA.
Como JK via o pan-americanismo no contexto da OPA?;Como um conceito a ser atualizado e transformado em unidade continental efetiva, e não em relações bilaterais.
Quais propostas JK apresentou no discurso para a América Latina?;Intensificar investimentos em regiões menos desenvolvidas, assistência técnica, proteção dos preços e reforma das instituições financeiras.
Quem foi Milton Eisenhower e qual sua relação com o Brasil?;Irmão do presidente dos EUA, visitou o Brasil em 1953 e 1958, elaborando relatórios que influenciaram a OPA.
Qual a principal crítica do relatório de Milton Eisenhower ao Brasil?;Destacava a autossuficiência e o papel da iniciativa privada, mas causou desapontamento à embaixada brasileira.
O que o relatório de 1959 sugeria para a América Latina?;Criar uma agência interamericana de desenvolvimento econômico e enfatizar investimentos privados.
Por que o relatório de Milton Eisenhower não mencionava diretamente a OPA?;Indica o pouco interesse dos EUA na iniciativa brasileira.
Quando e como se dissiparam as desconfianças políticas Brasil-Argentina?;Com a queda de Perón (1955) e a ascensão de JK e Frondizi, com aproximação diplomática e cooperação econômica.
Qual foi a posição inicial do governo JK em relação aos EUA?;Maior alinhamento, com concessões como a base de rastreamento em Fernando de Noronha e apoio ao levante na Hungria.
O que foi a conferência de Buenos Aires em 1956?;Reunião de Brasil, Argentina e Uruguai para discutir defesa do Atlântico Sul, embrião da OTAS.
Quem foi eleito presidente da Argentina em 1958 e qual sua política externa?;Arturo Frondizi, com laços com Perón, favorecia os EUA, mas buscava relações melhores na América Latina.
Qual foi a postura da Argentina diante da OPA?;Apoio cordial, cauteloso e pragmático, sem envolvimento pleno para não perder apoio dos EUA.
O que resultou da diplomacia Brasil-Argentina em 1958 e 1959?;Criação do Grupo Industrial Brasil-Argentina e acordos comerciais (trigo, café, frutas, madeira).
Como foi a relação Brasil-Paraguai na década de 1950?;Aproximação devido à hostilidade argentina, com acordos comerciais e infraestrutura, como a Ponte da Amizade.
Qual foi o principal ponto de fricção Brasil-Paraguai?;Disputa pelo potencial hidrelétrico do Salto do Guairá (Sete Quedas), envolvendo demarcação de fronteira.
O que indicava a divisão da cordilheira de Mbaracayú para a disputa?;Dois ramais dividiam a fronteira: Paraguai defendia o ramal norte, Brasil o sul, por interesses hidrelétricos.
Qual a importância da Bolívia para a geopolítica brasileira?;"Considerada ""heartland"" sul-americana, com riqueza em recursos e ligação entre bacias Amazônica e Platina."
O que tratavam os Acordos de Roboré de 1958?;Exploração de petróleo/gás, ferrovia Corumbá-Santa Cruz e circulação de mercadorias bolivianas.
Qual o papel do Brasil na Questão de Suez (1956) na ONU?;Defendeu cessar-fogo e retirada das tropas, participou da UNEF I com o Batalhão de Suez, e liderou nos anos finais.
Que discurso Oswaldo Aranha fez na AGNU de 1958?;Destacou que agora era o momento dos países menos desenvolvidos após recuperação da Europa com Plano Marshall.
O que defendeu Horácio Lafer na AGNU de 1960?;Coexistência pacífica, combate à segregação, desenvolvimento econômico e ampliação do Conselho de Segurança da ONU.
Como o Brasil votou sobre a descolonização e independência africana?;Votou a favor da resolução de descolonização, mas não apoiou a independência da Argélia contra a França.
Como era a relação do Brasil com Portugal nos anos 1950?;Relações diplomáticas, visita do presidente Craveiro Lopes, mas com oposição interna contra Salazar.
Quando o Brasil estabeleceu relações comerciais com a URSS?;Em 1959, com missão comercial e acordo de troca (café por trigo e petróleo), sem restabelecer relações diplomáticas.
Como era a relação do Brasil com a Comunidade Europeia (CEE)?;Parceria estabelecida em 1960, apesar de críticas à política agrícola europeia e proteção de colônias africanas.
Que montadoras estrangeiras investiram no Brasil nos anos 1950?;Volkswagen, Mercedes-Benz e DKW, influenciadas pela Instrução 113 da SUMOC.
O que foi a Operação Brasil-Ásia iniciada em 1957?;Missão para aproximar o Brasil de países asiáticos como Indonésia, Japão, Irã, Singapura e Malásia.
Quais países da Ásia estabeleceram relações diplomáticas com o Brasil entre 1959 e 1960?;Vietnã do Sul, Tailândia, Malásia, Coreia do Sul e Ceilão (Sri Lanka).
Quem foi o primeiro chefe de Estado asiático a visitar o Brasil?;Sukarno, presidente da Indonésia, em 1959 e novamente em 1960.
Como eram as relações do Brasil com a China nessa época?;Limitadas a Taiwan desde 1952, sem relações com a República Popular da China, que só seriam revistas mais tarde.
Quando ocorreu o rompimento de JK com o FMI?;Em 17 de junho de 1959.
Por que JK rompeu com o FMI?;Porque o governo brasileiro recusou-se a aceitar as exigências do FMI para concessão de financiamentos.
Como a população do Rio reagiu ao rompimento de JK com o FMI?;Compareceu em massa ao Palácio do Catete, mostrando solidariedade ao presidente e apoio à diplomacia com URSS e RPC.
Quais investimentos japoneses destacam-se no Brasil no Plano de Metas?;Usiminas (1956), Toyota (1958) e Estaleiros Ishikawajima (1959).
Como o Brasil votou em relação à admissão do Japão na ONU?;Votou a favor da resolução A/Res/1113 em 1956.
Quem visitou o Brasil em 1958 em comemoração aos 50 anos da imigração japonesa?;O príncipe e a princesa Mikasa.
Quem foi o primeiro-ministro japonês que visitou o Brasil em 1959?;Shinsuke Kishi.
Que acordo foi firmado entre Brasil e Japão em novembro de 1960?;Acordo de Migração e Colonização.
Qual elemento marcou a política externa do governo Jânio Quadros?;Um caráter voluntarista, com críticas aos moldes tradicionais (vitorianos) da política externa brasileira.
Quem foi o ministro das Relações Exteriores no governo Jânio Quadros?;Afonso Arinos de Melo Franco.
Quais foram algumas das necessidades internas que motivaram mudanças na política externa brasileira?;Obtenção de divisas, escoamento de produtos primários, sustentação de preços, investimentos e tecnologia estrangeira.
O que foi a Política Externa Independente (PEI)?;Conjunto de princípios que buscava universalizar e dar autonomia à política externa brasileira, reduzindo dependência dos EUA.
Quais os principais objetivos da PEI?;Mundializar relações, evitar alinhamentos ideológicos, ampliar mercados, buscar desenvolvimento, paz e autodeterminação dos povos.
Qual a principal diferença da PEI em relação à política externa de JK?;A PEI tinha forte caráter autonomista e universalista, afastando-se do eixo exclusivamente norte-americano.
Como a PEI via a relação Brasil-EUA?;Visto que a presença hegemônica dos EUA impunha constrangimentos, era necessária a diversificação das parcerias.
Que países Jânio Quadros buscou aproximar na política externa?;Iugoslávia, Cuba, China Popular e União Soviética.
Qual a principal preocupação da política externa de Goulart?;Ampliação do mercado externo e continuidade da PEI com maior pragmatismo e profissionalismo.
Quem foi o primeiro ministro das Relações Exteriores de Goulart?;Francisco Clementino de San Tiago Dantas.
Quais os fundamentos da PEI?;Universalismo, pragmatismo, autonomia, anticolonialismo, autodeterminação dos povos, desenvolvimento e não intervenção.
Como a PEI encarava o subdesenvolvimento mundial?;Como principal desafio pós-guerra, exigindo esforço global para acelerar o crescimento dos países subdesenvolvidos.
Que postura a PEI adotou em relação às colônias remanescentes?;Defesa da liquidação do colonialismo e apoio à descolonização, conforme Declaração da ONU de 1960.
Segundo Jânio, qual o lugar do Brasil no mundo?;Pertence ao hemisfério ocidental, mas deve ampliar relações para além dele, incluindo países afro-asiáticos.
Que conceito a PEI buscava implementar na política externa?;A coexistência entre desenvolvimento econômico e soberania política, com destaque para o Sul-Sul.
Como a PEI influenciou ações brasileiras em organismos internacionais?;Destacou-se na ALALC, ALADI, UNCTAD, G77 e defesa da segurança econômica coletiva.
Qual crise continental exemplificou os princípios da autodeterminação e não intervenção na PEI?;A crise cubana, com críticas às intervenções das democracias capitalistas.
O que a Declaração de Uruguaiana (1961) reafirmou sobre o Brasil?;O pertencimento do Brasil ao hemisfério ocidental, mantendo estratégia independente do americanismo.
Como o Brasil se posicionou na VIII Reunião de Consulta do sistema interamericano em 1962?;Absteve-se da proposta dos EUA de excluir Cuba do sistema, em oposição à exclusão.
Qual era a nova política da PEI para a África?;Baseada em raízes culturais comuns e ausência de preconceito racial, o Brasil se apresentou como elo entre África e Ocidente.
Que ações brasileiras reforçaram a política para a África na PEI?;Criação do Grupo de Trabalho para África, IBEAA, abertura de embaixadas em Gana, Senegal e Nigéria.
Quem foi o primeiro embaixador brasileiro na África Subsaariana?;Raimundo de Souza Dantas, escritor negro nomeado embaixador em Acra (Gana).
Qual era uma das diretrizes da PEI sobre África e Ásia?;Reconhecer e valorizar interesses comuns entre Brasil e países da África e Ásia, fortalecendo relações Sul-Sul.
Como o Brasil participou do Movimento dos Países Não Alinhados (MNA)?;Enviou observador à conferência preparatória no Cairo em 1961.
Qual foi a posição do Brasil sobre colonialismo e apartheid na ONU?;Absteve-se em algumas resoluções e votou a favor no Conselho de Segurança contra colonialismo e apartheid.
O que significa o universalismo na PEI?;Neutralidade na disputa Leste-Oeste, mantendo autonomia para decidir caso a caso sem obrigações de defesa automática.
Qual crítica a PEI fazia à bipolaridade da Guerra Fria?;A bipolaridade limitava o desenvolvimento por exigir gastos militares e restringir ações diplomáticas.
Quais foram algumas ações pacifistas da PEI?;Participação na crise dos mísseis (Missão Albino), Conferência do Desarmamento e apoio ao Tratado de Tlatelolco.
Como a PEI buscou ampliar suas relações internacionais?;"Missões comerciais e retomada de relações diplomáticas com URSS, China e Europa Oriental; criou a COLESTE (1962)."
Quais obstáculos dificultaram a implementação da PEI?;Contexto interno e externo adverso, resistência ao universalismo, e pressão da bipolaridade global da Guerra Fria.
Qual foi o legado da PEI para a política externa brasileira?;Atualização dos paradigmas, base para a Constituição (Art. 4º) e inspiração para governos futuros como Geisel e Lula.
Qual era a expressão usada para definir a relação Brasil-EUA no governo Jânio Quadros?;"""Sincera colaboração""."
Qual foi a reação brasileira à visita de Adolf Berle Jr. em 1961?;Resposta negativa ao pedido de apoio para conter Cuba comunista.
O que o Brasil exigia para apoiar a Aliança para o Progresso (AP)?;Que a AP não fosse obstáculo ao desenvolvimentismo brasileiro.
Como o Brasil buscava maximizar ganhos na relação com os EUA?;Adotando um “neutralismo tático” e diversificando fontes de financiamento, inclusive com o bloco socialista.
Qual impacto teve a emenda Hickenlooper (1963) dos EUA sobre o Brasil?;Suspensão da ajuda americana a países que desapropriavam bens sem indenização imediata, afetando o Brasil.
O que ocorreu entre 1959-1962 no Rio Grande do Sul envolvendo empresas dos EUA?;Encampação de empresas norte-americanas pelo governo de Leonel Brizola.
Qual foi a consequência do descumprimento do Acordo Bell-Dantas?;Reforço do apoio de Washington a setores que desejavam derrubar o governo Goulart.
Que instituições americanas financiaram propaganda ideológica contra Goulart?;IPES e IBAD.
Qual foi o papel do adido militar Vernon Walters em 1963-64?;Coordenar ações para desestabilizar o governo brasileiro.
O que declarou o governo dos EUA em nota no New York Times em 1964?;Que não se oporia a golpes militares na América Latina.
Qual era a posição do Brasil sobre a invasão da Baía dos Porcos?;Expressou “profunda apreensão” e votou contra intervenções que violassem a soberania de Cuba.
O que o Brasil fez na votação da exclusão de Cuba da OEA em 1962?;Absteve-se junto com outros cinco países (outer six), recusando o intervencionismo.
Como o Brasil posicionou-se durante a crise dos mísseis de 1962?;Favorável ao bloqueio naval, mas contrário à intervenção militar e embargo econômico.
Qual foi a importância do encontro Jânio-Frondizi em Uruguaiana (1961)?;Foi marco para superar rivalidades Brasil-Argentina e firmar cooperação política, econômica e cultural.
O que expressa a “Declaração de Uruguaiana”?;Alinhamento das políticas internacionais conforme identidade sul-americana, defesa da democracia e apoio à ALALC.
Qual foi a consequência política para a Argentina após 1962?;Golpe que depôs Frondizi, retomada de alinhamento com os EUA e ruptura do “Espírito de Uruguaiana”.
Qual problema de fronteira surgiu com o Paraguai no início dos anos 1960?;Disputa pela região do Salto das Sete Quedas, com reivindicação brasileira de soberania.
Como foi resolvida a disputa hidrelétrica entre Brasil e Paraguai em 1964?;Criada Comissão Mista para estudar a exploração, sem tocar na disputa de soberania.
Que países da América Latina Goulart visitou em 1962?;México e Chile, para fortalecer autonomia política e econômica, e defender a autodeterminação.
Quais países participaram do processo de desarmamento nuclear liderado pelo Brasil?;Brasil, Bolívia, Chile, Equador e México, com a meta de acordo multilateral contra armas nucleares (Tlatelolco).
Que acordos o Brasil firmou com o Leste Europeu em 1961?;Acordos comerciais com Hungria, RDA, Romênia, Albânia, Iugoslávia e Bulgária.
Qual missão do Brasil criou a COLESTE em 1962?;Missão comercial ao Leste Europeu que institucionalizou a aproximação com o bloco socialista.
Quando foram restabelecidas as relações diplomáticas Brasil-URSS?;Em novembro de 1961, com nomeação de Vasco Leitão da Cunha como embaixador.
Que acordo comercial Brasil-URSS foi firmado em 1963?;"Brasil receberia petróleo, aviões e tratores; URSS receberia manufaturas, filmes e sucos."
Quem visitou o Brasil em 1963, simbolizando a aproximação com países não alinhados?;Tito, presidente da Iugoslávia.
Qual foi a declaração de Goulart durante a visita de Tito?;Deplorou a divisão em blocos e defendeu a paz mundial e a segurança econômica coletiva.
Qual foi o principal conflito diplomático Brasil-França na PEI?;A Guerra das Lagostas, com pesca ilegal e tensões diplomáticas entre 1963 e 1964.
Como terminou a Guerra das Lagostas?;Só em agosto de 1964, já no governo Castello Branco.
Que acordo econômico o Brasil assinou com a Indonésia em 1961?;Acordo bilateral econômico para fortalecer relações comerciais.
Quando foi assinado o acordo comercial com a Coreia do Sul?;Em 1963, iniciando também a imigração coreana ao Brasil.
Qual foi a posição do Brasil sobre a representação da China na ONU?;Tentou apoiar a entrada da RPC na agenda da ONU em 1961, mas manteve reconhecimento formal a Taiwan.
Qual visita importante João Goulart fez para estreitar laços com a China?;Visita a Pequim em agosto de 1961, com proposta de representação comercial mútua.
O que foi a Resolução 1668 da AGNU em 1961?;Determinou que questões sobre representação da China exigiriam 2/3 dos votos para decisão.
Como votou o Brasil sobre o comitê para investigar Angola na AGNU?;Absteve-se em 1961, mas condenou o assassinato de Patrice Lumumba.
Qual foi o tema do discurso dos 3Ds do chanceler Araújo Castro em 1963?;Desarmamento, desenvolvimento e descolonização.
Quais os principais pontos das políticas econômicas de Castello Branco?;Liberalismo econômico, cooperação nuclear com EUA, defesa do desenvolvimento e segurança coletiva.
Que continuidade houve entre os governos Dutra, Café Filho e Castello Branco?;Busca por autonomia nuclear e defesa do desenvolvimento econômico.
Qual divergência entre os governos Dutra e Castello Branco na PEI?;"Rompimento com URSS em Dutra, retomado na PEI e mantido em Castello; retórica diferente com EUA."
Como o governo Castello Branco viu a política “neutralista” da PEI?;Como uma característica a ser questionada ou ressignificada.
O que representa a teoria dos círculos concêntricos de Golbery?;Política externa com níveis: nacional (mais importante), regional e mundial (menos prioritário).
Qual era a visão de Castello sobre soberania nacional?;Autonomia total dentro do território brasileiro, controle e domínio soberano.
Que postura adotou o governo Castello com Cuba?;Rompeu relações diplomáticas em 1964.
Qual foi o papel do Brasil na Força Interamericana de Paz (FIP)?;Liderança na intervenção na República Dominicana.
Como o governo Castello lidou com pactos internacionais de direitos humanos?;Inicialmente recusou assinar os Pactos de Direitos Humanos (1966) e o Tratado de Tlatelolco (1967).
Quais obras bilaterais foram feitas com o Paraguai no governo Castello?;Ponte da Amizade (1965) e Ata das Cataratas (1966).
Que países tiveram rompimento ou ameaça de rompimento de relações?;Venezuela, México e Uruguai.
O Brasil enviou tropas para a Guerra do Vietnã?;Não, manteve-se fora do conflito.
"que significa dizer que a política externa de Castello Branco foi um ""passo fora da cadência""?";Foi um desvio temporário, pois governos posteriores retomaram bases da PEI por mudanças no sistema internacional.
Quais mudanças no sistema internacional dificultaram a política externa de Castello Branco?;Détente EUA-URSS, recuperação da Europa Ocidental e Japão, avanço do anticolonialismo e descolonização.
"O que é o ""universalismo inevitável"" segundo Cervo e Bueno?";Limitações para política externa do Brasil em três áreas: órgãos multilaterais, países socialistas e África Subsaariana.
"Quais órgãos multilaterais foram foco do Brasil no ""universalismo inevitável""?";UNCTAD, GATT, Conferência do Desarmamento e ONU.
Qual tese o Brasil defendeu na UNCTAD durante o governo Castello?;Segurança econômica coletiva.
Que postura o Brasil adotou no GATT?;Oposição ao Acordo de Têxteis e defesa da parte IV (comércio e desenvolvimento).
Como o Brasil atuou em relação aos países socialistas na época?;Mantinha comércio e comissões mistas, como COLESTE, sem romper com URSS, mas rompeu com Cuba.
Que missão importante ocorreu em 1965 no campo das relações com países socialistas?;Visita do ministro Roberto Campos à Moscou e reunião da comissão mista Brasil-URSS.
Qual era a posição do Brasil em relação à África Subsaariana?;Aproximação retórica contra colonialismo e apartheid, busca de mercados e aproximação com Portugal.
Que visita presidencial marcou as relações com a África em 1964?;Visita do presidente do Senegal, Léopold Senghor, ao Brasil.
Como ficaram as relações Brasil-Argentina após a queda de João Goulart?;Distanciamento político e rivalidade conjuntural entre 1964-1979.
Qual foi a estratégia de Castello Branco para a região do Prata?;Aproximação com Paraguai e resolução da disputa territorial com Ata das Cataratas (1966).
O que causou tensão entre Brasil e Paraguai em 1965?;Ocupação militar brasileira na região de Porto Coronel Renato para garantir potencial hidrelétrico.
Como terminou o conflito fronteiriço Brasil-Paraguai?;Assinatura da Ata das Cataratas (1966) e criação da Itaipu Binacional.
"Quem são os ""brasiguaios""?";Agricultores brasileiros que migraram para o Paraguai após facilitação da imigração.
Como as relações com a China foram afetadas após o golpe de 1964?;"A aproximação com a China comunista foi suspensa; presos chineses foram deportados; Brasil perdeu mercado chinês."
Que convênio nuclear o Brasil assinou com Israel em 1966?;Convênio sobre utilização da energia nuclear para fins pacíficos.
Qual foi a postura do Brasil na Guerra dos Seis Dias (1967)?;Participação discreta, mas votou favoravelmente à Resolução 242 do CSNU, iniciativa Brasil-Argentina.
Qual foi a principal mudança na política externa do governo Costa e Silva?;Abandono das fronteiras ideológicas e retomada do nacionalismo e terceiromundismo com foco no desenvolvimento.
"Quais os três focos da ""Diplomacia da Prosperidade"" no governo Costa e Silva?";Ampliação do comércio internacional, aquisição de ciência e tecnologia, aumento de fluxos financeiros.
Por que o Brasil rejeitou assinar o Tratado de Não Proliferação Nuclear (TNP) em 1968?;Para preservar autonomia nuclear e diversificar parcerias, como com a Índia.
Quais países tiveram destaque nas relações bilaterais com o Brasil no governo Costa e Silva?;Índia (Indira Gandhi), países africanos (RDC, Sudão) e Europa Oriental (Alemanha Oriental).
O que foi a Câmara de Comércio Afro-Brasileira (Afrochamber)?;Instituída em 1968 em São Paulo para fortalecer comércio com países africanos.
Qual tratado sul-americano importante foi assinado em 1967?;Tratado da Bacia do Prata (Brasil, Argentina, Uruguai, Paraguai e Bolívia).
O que foi o Consenso de Viña del Mar (1969)?;Documento de cooperação e transformação da Aliança para o Progresso, reforçando a unidade latino-americana.
Como eram as relações Brasil-EUA no governo Costa e Silva?;"Não alinhamento automático e início de ""rivalidade emergente""."
Qual foi a postura do Brasil na Guerra dos Seis Dias (1967)?;Apoio à Resolução 242 do CSNU, exigindo retirada de Israel dos territórios ocupados.
O que marcou a aproximação do Brasil com o Oriente Médio nesse período?;Criação do Grupo COARABE em 1969 para coordenar comércio com países árabes.
Qual postura Médici manteve em relação à política externa desenvolvimentista?;Continuou e fortaleceu a diplomacia para o desenvolvimento, rejeitando interdependência.
Como Médici se relacionou com os EUA?;"Não alinhamento automático, ""rivalidade emergente"" e cooperação no projeto da usina nuclear Angra I."
Como o Brasil lidou com o Tratado de Não Proliferação Nuclear no governo Médici?;Continuou sem apoio ao TNP, refletindo sobre o “congelamento do poder mundial”.
Qual foi o papel do Brasil na Conferência de Meio Ambiente de Estocolmo (1972)?;Buscou liderança entre países em desenvolvimento.
Qual acordo hidrelétrico importante foi firmado durante Médici?;Tratado de Itaipu (1973) e avanços no convênio para estudo do desvio do rio Paraná.
Quando entrou em vigor o Tratado da Bacia do Prata?;Durante o governo Médici, tratado assinado no governo Costa e Silva.
Qual foi a mudança central na política externa de Médici em relação a Costa e Silva?;Passou do terceiro-mundismo para o projeto de “Brasil potência”, privilegiando relações bilaterais.
Como foi o relacionamento do Brasil com o Conselho de Segurança da ONU durante Médici?;Houve afastamento do CSNU, mas manteve-se ativo em outras instâncias como o ECOSOC.
Qual preocupação a diplomacia regional tinha sobre o Brasil no governo Médici?;Medo de um papel “subimperialista” e desconfiança dos vizinhos sobre ambições brasileiras.
Quem foi o chanceler que ampliou as relações do Brasil com a América Central?;Mário Gibson Barboza, que visitou Guatemala, El Salvador, Honduras, Nicarágua e Costa Rica em 1971.
Como mudou a atuação do Brasil no G77 durante Médici?;Menos incisiva, mas com conquistas como a institucionalização do Sistema Geral de Preferências (SGP).
Qual país da Europa Oriental o Brasil reconheceu oficialmente em 1973?;República Democrática da Alemanha (Alemanha Oriental).
Como o Brasil se aproximou do Oriente Médio no governo Médici?;Visitas diplomáticas ao Egito, Israel, criação de embaixada na Líbia e relações com a Arábia Saudita.
Qual foi a postura do Brasil sobre a questão israelo-palestina na época?;Retórica nacionalista e pragmática, buscando apoio econômico dos países árabes após o choque do petróleo.
Como foi a relação Brasil-Argentina na “Revolução Argentina” (1966-1973)?;Inicialmente isolada e pró-EUA, depois busca autonomia e reaproximação regional.
