Sistema de parceria;Modelo de trabalho imigrante baseado na divisão de lucros e dívidas
Colonato;Sistema em que o trabalhador recebia salário fixo e parte da produção
Campanha abolicionista;Movimento de opinião pública amplo e multifacetado no século XIX
Sociedade Brasileira Contra a Escravidão (1880);Organização que impulsionou a campanha abolicionista
Lei do Ventre Livre (1871);Tornou livres os filhos de escravas nascidos após sua promulgação
Ingênuos;Filhos de mulheres escravizadas nascidos livres pela Lei do Ventre Livre
Lei dos Sexagenários (1885);Libertava escravos com mais de 60 anos
Joaquim Nabuco;Líder abolicionista moderado e defensor da abolição gradual
José do Patrocínio;Liderança abolicionista radical e ativista urbano
André Rebouças;Engenheiro e abolicionista ligado ao movimento popular
Luís Gama;Advogado e abolicionista defensor da libertação judicial de escravos
Movimento dos jangadeiros;Ação abolicionista no Ceará que contribuiu para a libertação provincial
Abolição no Ceará (1884);Primeira província brasileira a extinguir a escravidão
Amazônia (abolição antecipada);Região que também aboliu a escravidão antes de 1888
Reforma Dantas;Proposta liberal com medidas graduais de emancipação escrava
Resistência escravista;Ações legais e ilegais contra o movimento abolicionista
Institucionalização do abolicionismo;Entrada do movimento no sistema político na década de 1880
;
;
ei Áurea;Abolição formal da escravidão no Brasil em 1888
Lei Áurea;Extinção legal definitiva do cativeiro em 13 de maio de 1888
José do Patrocínio;Jornalista e orador que mobilizou a opinião pública pela abolição
André Rebouças;Intelectual que defendia reformas sociais e integração dos libertos
Luís Gama;Advogado que libertou escravizados por vias judiciais
Lei do Ventre Livre;Declarava livres os filhos de mulheres escravizadas
Lei do Ventre Livre;Liberdade do ventre com tutela até a idade adulta
Lei dos Sexagenários;Libertava escravizados com mais de 60 anos
Lei dos Sexagenários;Medida de impacto limitado que beneficiava proprietários
Lei Eusébio de Queirós;Proibição efetiva do tráfico negreiro em 1850
Lei Eusébio de Queirós;Extinção do tráfico transatlântico de escravos
Lei dos Africanos Livres;Libertação de africanos trazidos ilegalmente após proibição do tráfico
Sociedade Brasileira Contra a Escravidão;Organização que impulsionou a campanha abolicionista nos anos 1880
Gabinete Dantas;Tentativa de reforma abolicionista com forte oposição política
Gabinete Saraiva;Modificação do projeto abolicionista com indenização e transição gradual
Gabinete Cotegipe;Conduziu aprovação da Lei dos Sexagenários no Senado
Clubes da Lavoura;Organização de resistência dos escravistas às reformas abolicionistas
Movimento dos jangadeiros;Ação popular no Ceará que acelerou a abolição local
Abolição no Ceará;Primeira província brasileira a extinguir o cativeiro
Abolição no Amazonas;Segunda região a encerrar formalmente a escravidão
Campanha abolicionista;Movimento de massa com imprensa, rua e Parlamento
Tráfico interprovincial;Transferência de escravizados entre regiões após fim do tráfico atlântico
Sistema de semisservidão;Forma de trabalho rural híbrido entre liberdade e dependência
Guerra do Paraguai;Processo que intensificou debate sobre cidadania e escravidão
Lei de Terras de 1850;Restrição ao acesso à terra, favorecendo grandes proprietários
Imigração europeia;Substituição progressiva da mão de obra escravizada no Centro-Sul
Modernização conservadora;Modernização econômica sem mudança estrutural do sistema agrário-exportador
