O que é norma jurídica?;Regra que regula comportamentos sociais.
Por que a norma jurídica é importante?;Reduz incerteza e permite previsibilidade nas ações.
O que significa caráter imperativo da norma?;A norma é obrigatória e vinculante.
Por que o intérprete do direito não decide por preferências?;Porque deve seguir critérios da norma, não preferências pessoais.
O que qualifica a norma jurídica?;Condutas como obrigatórias, proibidas ou permitidas.
O que é hipótese normativa?;Situação de fato descrita pela norma.
Por que a norma prevê consequências?;Para ligar a ocorrência do fato a uma consequência jurídica.
O que Kelsen considera essencial na norma?;A sanção como característica definidora.
Por que a sanção deve ser coercitiva?;Para garantir força efetiva ou latente.
O que implica a sanção?;Privação de bens como liberdade, vida ou patrimônio.
Quem pode aplicar sanção jurídica?;Apenas autoridades autorizadas pela ordem jurídica.
Por que a sanção exige conduta voluntária?;Porque é aplicada a quem poderia agir de forma diferente.
O que caracteriza a sanção em caso de recusa?;Aplicação por recusa voluntária em cumprir o dever.
Qual exemplo não é sanção penal?;Execução forçada do direito privado.
Quais são exemplos de sanções penais?;Pena e multa.
Como o liberalismo clássico vê o direito?;Como ordem repressiva para conservar a sociedade.
O que o liberalismo clássico defende sobre Estado e sociedade?;Separação entre Estado e sociedade.
Qual é a função do direito segundo o liberalismo clássico?;Conservar a ordem punindo desvios.
A sanção jurídica pode envolver perda da vida?;Sim, pode envolver vida, liberdade ou patrimônio.
Quando a autoridade pode aplicar sanção?;Apenas com autorização expressa do ordenamento jurídico.
A sanção precisa estar prevista na norma?;Sim, é essencial para validade e aplicação.
A norma jurídica garante cumprimento voluntário?;Não, por isso há sanção para coerção.
Qual o objetivo da execução forçada no direito privado?;Garantir cumprimento de obrigações.
A função do direito mudou com o Estado providência?;Sim, passou a estimular resultados além da repressão.
Que técnicas o Estado providência usa no direito?;Promoção e encorajamento, como incentivos fiscais.
Qual a importância das sanções premiais no Estado providência?;Ganharam maior importância que sanções negativas.
A sanção é indispensável na norma jurídica hoje?;Não, perdeu esse caráter, mas mantém relevância.
O que normas de organização estabelecem?;Competências públicas e privadas.
A nulidade é uma sanção?;Não, é consequência jurídica, não sanção clássica.
O que a sanção tradicional envolve?;Privação de bens.
Qual o objetivo da nulidade?;Invalidar atos ilegais, não provocar desagrado.
Quando sanções são reconhecidas juridicamente?;Apenas quando previstas nas normas.
Generalidade e abstração são sempre sinônimos?;Não, às vezes são distintos na doutrina.
O que é decisão judicial em termos normativos?;Norma jurídica individual, aplicável às partes do processo.
Como a Escola da Exegese via a decisão judicial?;Como mera aplicação da lei, para evitar arbítrio.
Toda norma jurídica precisa ser geral e abstrata?;Não, há normas individuais e concretas.
Normas que revogam outras normas são normas?;Sim, fazem parte do ordenamento jurídico.
O que é generalidade na norma?;Abrange categorias ou classes de agentes.
O que é abstração na norma?;Abrange categorias de ações, não ações específicas.
Qual é a oposição de generalidade e abstração?;"Generalidade é oposta ao individual; abstração ao concreto."
Por que a norma geral é importante?;Garante imparcialidade e igualdade.
A norma abstrata compromete a certeza do direito?;Não, promove certeza e previsibilidade.
Por que crescem as normas individuais e concretas?;Devido à maior intervenção estatal.
Generalidade e abstração são características objetivas?;Não, são ideais do liberalismo, não sempre presentes.
O que significa bilateralidade?;Alteridade entre sujeitos, não só relação credor-devedor.
Normas que conferem capacidade jurídica são bilaterais?;Sim, porque envolvem posições jurídicas distintas.
O que é bilateralidade na norma jurídica?;Alteridade entre sujeitos, não só relação obrigacional.
Por que nem toda norma exige generalidade, abstração ou sanção?;Doutrina moderna reconhece diversidade nas normas.
Quais os três prismas para analisar a norma jurídica?;Fundamento (justiça), validade (existência), eficácia (respeito).
O que é fundamento da norma jurídica?;Valores que justificam a obrigatoriedade da norma.
O que é eficácia da norma jurídica?;Respeito e cumprimento concreto da norma pelos destinatários.
Qual a natureza do fundamento da norma?;Essencialmente filosófica, ligada à legitimação valorativa.
O que é validade da norma jurídica?;Inserção correta da norma no ordenamento jurídico.
Por que a validade da norma não é absoluta?;Depende da relação com outras normas do sistema.
O que compõe o ordenamento jurídico além de normas?;Classificações, definições legais e preâmbulos.
Qual a função dos preâmbulos legais?;Esclarecer o sentido das normas no ordenamento.
O que determina a existência jurídica da norma?;Sua validade dentro do ordenamento.
Por que o ordenamento jurídico inclui definições e classificações?;Para organizar e explicar o conteúdo jurídico.
O que é necessário para a validade da norma?;Competência, matéria adequada e procedimento correto.
Quem confere a competência legislativa?;Norma superior delimita o órgão competente.
Quem julga o presidente da República por crime comum?;Supremo Tribunal Federal.
Quem julga o presidente por crime de responsabilidade?;Senado Federal.
O que pode a Câmara dos Deputados no processo de impeachment?;Admitir a acusação, não julgar.
Quando o presidente pode editar medidas provisórias?;Em casos de relevância e urgência.
Quem não pode editar medidas provisórias?;Presidente do STF e outros órgãos que não a Presidência.
O que acontece se uma norma desrespeita o procedimento legal?;Ela é inválida.
O que determina a validade da norma além da competência?;Matéria adequada e respeito ao procedimento.
O que significa revogação de norma?;Norma perde vigência por norma posterior.
A revogação pode ser tácita?;Sim, por incompatibilidade com norma nova.
O que pode causar a revogação tácita?;Incompatibilidade entre normas antiga e nova.
O que deve o Congresso Nacional fazer no recesso?;Ser convocado para analisar medidas provisórias.
Qual a competência legislativa para direito comercial?;Privativa da União.
A competência do órgão legislador é importante?;Sim, é requisito essencial para validade da norma.
Qual o quórum necessário para alterar a Constituição?;Três quintos dos votos, em dois turnos, na Câmara e Senado.
O que determina a validade de uma norma?;Pode ser prazo fixado ou vigorar até ser revogada.
Quando a norma jurídica é válida?;A partir da publicação.
O que é vigência da norma jurídica?;Período em que a norma pode produzir efeitos jurídicos.
A norma pode ser válida sem estar vigente?;Sim, válida desde a publicação, mas vigência começa depois.
O que indica o vigor da norma?;Obrigatoriedade e poder vinculante sobre destinatários.
O que acontece com normas revogadas?;Perdem validade e vigência, mas mantêm efeitos já produzidos.
Como normas revogadas atuam sobre fatos passados?;Mantêm vigor sobre efeitos produzidos enquanto vigentes.
Normas com defeitos técnicos podem produzir efeitos?;Sim, podem adquirir imperatividade e ser convalidadas.
O que é eficácia da norma jurídica?;Capacidade da norma de produzir efeitos jurídicos.
Toda norma existente é eficaz?;Não, eficácia depende da aceitação e aplicação prática.
Quais condições são necessárias para a eficácia da norma?;Condições fáticas e técnicas de atuação.
Uma lei que exige o impossível será eficaz?;Não, será ineficaz por falta de condições fáticas.
O que é necessário para que uma norma seja plenamente eficaz?;Regulamentação infraconstitucional, quando prevista.
Validade e eficácia são conceitos independentes?;Não, são relacionados, mas diferentes.
Pode-se aplicar norma válida antes de sua eficácia plena?;Sim, norma válida pode ser aplicada mesmo sem eficácia total.
O que o desuso contínuo pode causar à norma?;Pode levar à perda da validade prática.
O que é uma norma eficaz?;Norma seguida voluntariamente ou imposta por sanção.
O que determina a vigência da norma?;Quando a norma pode produzir efeitos, não quando é válida.
Norma que nunca é aplicada perde validade?;Sim, pela extinção prática, mesmo sem revogação formal.
Pode norma vigente ser ineficaz?;Sim, se faltar condições para atuar.
Normas podem ser eficazes sem regulamentação?;Sim, se forem autoaplicáveis e tiverem condições fáticas.
Vigência e eficácia são a mesma coisa?;"Não, vigência é período; eficácia é produção de efeitos."
O que são normas primárias?;Estabelecem obrigações.
O que são normas secundárias?;Conferem poderes ou competências, criam e modificam normas.
Normas secundárias têm função prática?;Sim, regulam criação, modificação e reconhecimento normativo.
O que fazem as normas secundárias de reconhecimento?;Identificam normas válidas no ordenamento jurídico.
Como o critério espacial classifica normas internas?;Em federais, estaduais e municipais.
Normas internas podem ser aplicadas em outro Estado?;Não, depende do consentimento do Estado receptor.
O que são normas provisórias?;Normas com vigência limitada a prazo determinado.
O que são normas permanentes?;Normas sem prazo para cessação dos efeitos.
Qual é a regra geral sobre efeito das leis no tempo?;Produzem efeitos apenas para o futuro, salvo exceções.
Normas gerais regulam casos específicos?;Não, normas gerais aplicam-se a todos os que se enquadrem.
Exemplos típicos de normas individuais?;Decisões judiciais e contratos específicos.
O que são normas cogentes?;De ordem pública, obrigatórias e não modificáveis pelas partes.
O Código de Defesa do Consumidor estabelece normas de que tipo?;Cogentes, obrigatórias e de interesse social.
O que são normas dispositivas?;Podem ser afastadas pela vontade das partes, são supletivas.
O que são normas minus quam perfecta?;Mantêm o ato válido, punem o infrator com sanção.
O que fazem as normas maius quam perfecta?;Invalidam o ato e punem o infrator.
Qual a função das normas proibitivas?;Proíbem a prática de determinado ato.
O que são normas permissivas?;Permitem praticar ou abster-se de certos atos, sem obrigação.
O que são normas secundárias de mudança?;Regulam criação e alteração de outras normas.
Como a Constituição distribui competências?;Entre União, Estados e Municípios, cada um com sua esfera.
O que ocorre em caso de competência privativa?;Não há hierarquia entre normas federais, estaduais e municipais.
O que é fato jurídico?;Evento ligado pelo direito a consequências jurídicas.
Todo fato natural é fato jurídico?;Não, apenas os que o direito vincula a efeitos legais.
O que transforma fato em ato jurídico?;O sentido normativo atribuído pelo direito.
Qual o papel da norma jurídica segundo Kelsen?;Dá sentido jurídico aos fatos naturais e sociais.
Toda troca de cartas constitui contrato?;Não, só se cumprir requisitos legais.
Todos fatos naturais produzem efeitos jurídicos?;Não, só os regulados pelo ordenamento.
A existência do Parlamento depende do quê?;Da conformidade com normas constitucionais.
Inundações podem gerar responsabilidade jurídica?;Sim, dependendo da legislação e circunstâncias.
Fato jurídico depende sempre da vontade humana?;Não, também pode ser evento natural com efeitos jurídicos.
Quando inicia a personalidade jurídica?;No nascimento com vida.
A vontade é relevante para ato jurídico?;Sim, é essencial para sua constituição.
Quem pratica atos jurídicos?;Administração pública e particulares.
Existe distinção entre atos jurídicos e negócios jurídicos?;Sim, negócios têm finalidade específica.
Transferência de domicílio é ato jurídico com destinatário?;Não, não possui destinatário específico.
Participações possuem destinatário?;Sim, dirigidas ao conhecimento de alguém.
Intenção é relevante nos atos materiais?;Não, pois não visam comunicação.
O que é negócio jurídico?;Ato com fim de produzir efeitos no direito privado.
O que simboliza o negócio jurídico?;A autonomia da vontade.
A liberdade como domínio da vontade é característica de qual época?;Da modernidade.
Onde a liberdade era vivida na Antiguidade?;No âmbito público, na vida política.
A liberdade individual moderna existia na Antiguidade?;Não, é fenômeno recente.
Autonomia da vontade pressupõe o quê?;Liberdade absoluta da vontade.
O que exigiu a formação da esfera privada moderna?;Autonomia da vontade, mobilidade social e livre circulação da riqueza.
Como se caracteriza o mercado?;Descontinuidade das trocas e continuidade da previsão.
Quando foi concebido o conceito de negócio jurídico?;No século XIX pela pandectística alemã.
O conceito de negócio jurídico busca quê?;Abstração e generalização para explicar fenômenos jurídicos.
O que une adoção, testamento e contrato como negócios jurídicos?;A vontade é o elemento comum que os identifica.
Qual o papel da vontade no negócio jurídico?;Protege a autenticidade e liberdade da manifestação da vontade.
Como a vontade influenciou a separação entre esferas pública e privada?;Fundamentou a distinção entre domínio privado e público.
Que tipo de igualdade o conceito de negócio jurídico promove?;Igualdade formal entre as pessoas.
Como o negócio jurídico contribuiu para o Direito?;Simplificou e organizou a linguagem e o raciocínio jurídico.
O que o Código Civil regula sobre negócios jurídicos?;Requisitos, defeitos, modalidades, provas e invalidade.
A capacidade genérica basta para validar um negócio jurídico?;Não, também é preciso ausência de impedimentos específicos.
Quem é absolutamente incapaz para negócios jurídicos?;Menores de 16 anos.
Pode o tutor comprar bens do pupilo em hasta pública?;Não, é proibido pelo Código Civil.
Quais são requisitos do objeto do negócio jurídico?;Deve ser lícito e possível.
Todas as formas de negócio jurídico exigem forma especial?;Não, salvo quando a lei exigir (ex: testamento).
Por que o testamento exige forma especial?;Para garantir sua validade conforme previsto no Código Civil.
Como devem ser provadas obrigações superiores a dez salários mínimos?;"Com início de prova por escrito; prova exclusivamente testemunhal não basta."
Negócios jurídicos unilaterais são praticados por quantas pessoas?;Uma declaração de vontade, mas pode envolver várias pessoas.
O que é necessário nos negócios jurídicos bilaterais?;Coincidência das declarações de vontade sobre o objeto.
Nos negócios plurilaterais, as partes têm interesses opostos?;Não, têm mesmo intento e interesses autônomos.
O contrato de compra e venda é unilateral ou bilateral?;Bilateral, pois envolve duas vontades coincidentes.
Nos negócios onerosos, há contraprestação?;Sim, a vantagem de uma parte corresponde a contraprestação da outra.
O testamento é negócio jurídico inter vivos ou mortis causa?;Mortis causa, produz efeitos após a morte.
Negócios inter vivos produzem efeitos quando?;Enquanto as partes estão vivas.
O erro acidental anula o negócio jurídico?;Não, só o erro substancial e inescusável.
Onde pode incidir o erro substancial?;Sobre qualidades essenciais da pessoa ou do negócio.
O dolo resulta só de ações comissivas?;Não, pode decorrer também de omissões intencionais.
A coação anula o negócio jurídico quando?;Quando elimina a livre manifestação da vontade.
O silêncio pode ser considerado dolo?;Sim, se ocultar fato relevante em negócios bilaterais.
Os vícios do consentimento influenciam a validade do negócio?;Sim, podem levar à anulação.
Qual a diferença entre negócio nulo e anulável?;"Nulo é inválido desde o início; anulável produz efeitos até anulação."
Quem pode alegar a nulidade do negócio jurídico?;Qualquer interessado ou o juiz de ofício (nulidade é ordem pública).
Quem pode pedir a anulabilidade do negócio?;"Só a parte interessada; juiz não pode reconhecer de ofício."
O que impede a convalidação dos negócios jurídicos nulos?;Vícios graves que impedem sua validade.
Qual a diferença entre nulidade e anulabilidade quanto ao tempo?;"Nulidade é imprescritível; anulabilidade está sujeita à prescrição."
Por que negócios inexistentes não podem ser convalidados?;Faltam elementos essenciais, como determinação da coisa ou preço.
O que é relação jurídica?;Relação social regulada pelo direito que gera consequências jurídicas.
O que é necessário para existir relação jurídica?;Relação intersubjetiva + qualificação normativa.
Quem são os sujeitos da relação jurídica?;Titular do direito e sujeito do dever jurídico.
Qual o objeto da relação jurídica?;Coisa (direitos reais) ou prestação (direitos obrigacionais).
O que inclui o conceito de fato jurídico?;Acontecimentos naturais e negócios humanos previstos em lei.
O que garante a proteção do direito na relação jurídica?;Uso da força do Estado para proteger o direito.
Como Kelsen entende a relação jurídica?;Relação entre normas que prescrevem comportamentos.
O que determina a teoria tradicional sobre a relação jurídica?;Estrutura de posições jurídicas reguladas pelo direito.
Como o jusnaturalismo define o direito?;Ordem justa da coexistência, sem depender da força.
Qual é a explicação do contrato social no jusnaturalismo?;Justifica a criação do Estado e direitos civis protegidos.
Como o positivismo jurídico relaciona direito e poder?;Direito ligado ao poder estatal e coação.
Como Jhering e Austin veem o direito?;Normas coativas vigentes em um Estado.
O que Kelsen diz sobre a coação e eficácia do direito?;Coação é parte da norma, não questão de eficácia.
Como Olivecrona define o direito?;Regras que regulam o uso da força.
O que Alf Ross afirma sobre a ordem jurídica?;Conjunto de regras para estabelecer aparato de força.
O que Hart afirma sobre normas primárias e secundárias?;Sistema formado por normas primárias e secundárias.
Qual a função das regras secundárias segundo Hart?;Conferir poder para criar, modificar ou revogar normas.
O que elimina a incerteza sobre normas válidas?;Regra de reconhecimento.
O que ocorre sem regras de mudança?;Normas primárias ficam estáticas e mudam só com tempo social.
Qual a função das regras de julgamento?;Criar órgãos para resolver conflitos e punir violações.
Qual a visão de Bobbio sobre coação nas normas jurídicas?;Coação é conteúdo próprio das normas jurídicas.
O que regula o direito segundo Bobbio?;Comportamentos coativos que envolvem uso da força.
O que Bobbio compara à coação no direito?;Coação é para o direito como a linguagem é para a gramática.
Quais sanções existem no direito?;Sanções privativas (retiram força) e punitivas (aplicam força).
Qual era a função do direito no Estado liberal?;Função repressiva, punindo comportamentos indesejáveis.
O que busca a teoria do direito reflexivo?;Regulação dos interesses por indivíduos e organizações.
A coação é o único conteúdo do direito hoje?;Não, o direito evoluiu e abrange mais funções.
Qual função do direito destaca Bobbio?;Determinar condições para exercício do poder coativo.
O que o direito estabelece sobre o poder coativo?;Quem pode e deve exercer a força.
O direito prevê procedimentos para o poder coativo?;Sim, determina procedimentos a serem seguidos.
O que o direito determina sobre a quantidade de força?;Limita a força legítima das autoridades.
A obrigatoriedade da lei é só da lei formal?;Não, inclui decisões judiciais e contratos.
Como a lei refletia o Estado liberal?;Expressava participação popular e limitava o poder estatal.
Quando a norma jurídica é válida para o jusnaturalismo?;Quando é justa, derivada do direito natural.
Quando ocorre sanção por norma religiosa?;No plano transcendente, após a morte.
O que é a sanção moral?;Imposição interna, sentida pela consciência (remorso).
Por que normas morais exigem adesão espontânea?;Porque não podem ser impostas pela força física.
Por que a ordem jurídica pode usar força?;Para garantir cumprimento das normas, inclusive com sanções.
Quando o direito pode usar a força?;Apenas nas situações previstas pelas normas.
Por que a sanção jurídica é pré-determinada?;Para que o indivíduo saiba as consequências do seu ato.
"O que garante o princípio ""não há crime sem lei anterior""?";Segurança jurídica e tipicidade das condutas.
Por que a sanção jurídica exige aparato institucional?;Para ter processos e órgãos específicos para aplicá-la.
Quem usava a força na Antiguidade para vingança?;Particulares, não só o Estado.
Qual o monopólio estatal da força na Era Moderna?;Poder legítimo e exclusivo do Estado para usar a força.
Quando particulares podem usar a força?;Quando autorizados por delegação do Estado.
O que determina o grau de institucionalização da norma jurídica?;O caráter jurídico da norma.
"O que é o ""relato"" na comunicação normativa?";A mensagem transmitida.
"O que é o ""cometimento"" na comunicação normativa?";A relação entre comunicador e receptor sobre interpretação.
O que o cometimento jurídico exige?;Referência a um terceiro comunicador para validar autoridade.
Como é o consenso nas normas jurídicas da Era Moderna?;Anônimo e presumido, não explícito nem nominal.
Como procedimentos como eleições influenciam normas?;Conferem legitimidade e maior institucionalização.
O que prevalece: acordos privados ou normas tributárias?;Normas tributárias com maior institucionalização.
Qual o princípio da hierarquia das normas?;Constituição como norma fundamental.
Como Hans Kelsen representou o sistema jurídico?;Como uma pirâmide normativa com a Constituição no topo.
A hierarquia normativa é absoluta no Estado intervencionista?;Não, normas inferiores podem criar novas cadeias normativas.
Qual a natureza do princípio da hierarquia?;Jurídico-política, orienta decisões judiciais.
Os ordenamentos jurídicos são apenas hierárquicos?;Não, são equifinalísticos, permitindo vários meios para o mesmo fim.
O que diz o art. 2º do Código Civil sobre a personalidade?;Toda pessoa humana tem capacidade para direitos e deveres.
Como eram os escravos na Antiguidade juridicamente?;Eram objetos, não sujeitos de direito.
"O que originalmente significava ""pessoa""?";Máscara do ator, depois personagem, depois ser humano.
Qual contribuição do cristianismo para a igualdade moral?;Afirmou dignidade e igualdade moral entre os homens.
Como o jusnaturalismo entende os direitos humanos?;Direitos inatos, anteriores à ordem jurídica positiva.
O que Kant dizia sobre o tratamento do homem?;Homem é fim em si mesmo, não meio para outros fins.
Quando se reconheceu personalidade jurídica universal?;A partir do século XIX com os grandes códigos modernos.
O que dizia Savigny sobre capacidade jurídica?;Só o indivíduo natural tem capacidade jurídica.
O que é personalidade jurídica artificial?;Criada pelo direito, diferente da natural do homem.
A capacidade plena é garantida para todos?;Não, depende de idade e saúde para segurança.
Qual a diferença entre capacidade de direito e de fato?;"Direito é a personalidade comum; fato depende de condições específicas."
Quem são absolutamente incapazes na vida civil?;Menores de 16 anos, loucos e surdos-mudos.
O que pressupõe capacidade de fato?;Presupõe a capacidade de direito, mas não o contrário.
Quem administra bens dos filhos menores?;Os pais, como representantes legais.
Todos têm direitos políticos livres?;Não, dependem de requisitos legais.
Qual a idade penal para ser imputável?;Maior de 18 anos.
O que é capacidade em sentido amplo e específico?;"Amplo: aptidão para direitos; específico: possibilidade de exercê-los."
O que é personalidade jurídica?;Papel objetivo conferido pela lei, distinto do conceito moral.
O que defende a teoria da ficção sobre pessoa jurídica?;Pessoa jurídica é ente artificial criado pelo direito, sem vontade própria.
O que afirma a teoria realista sobre pessoa jurídica?;Pessoa jurídica tem vontade própria distinta da soma dos membros.
O que admite a teoria realista sobre atos ilícitos da pessoa jurídica?;Pessoa jurídica pode responder por atos ilícitos.
Como Hans Kelsen vê pessoa física e jurídica?;Ambos são conjuntos normativos, sem diferença fundamental.
O que Kelsen diz sobre atos de indivíduos em pessoa jurídica?;Atos autorizados são imputados à pessoa jurídica.
O que é a teoria da instituição sobre pessoa jurídica?;Unidade criada para objetivos comuns, organização é essencial.
Como são os papéis dentro da pessoa jurídica, segundo Tercio Sampaio Ferraz Jr.?;São isolados e reagrupados, sem comunicação direta.
Como atua o órgão de pessoa jurídica, como um presidente?;Atua no papel estatutário, não como indivíduo comum.
Qual a personalidade jurídica do Brasil internacionalmente?;Soberana, garantindo independência e responsabilidade.
Quem são pessoas jurídicas de direito público no Brasil?;União, Estados, Municípios, autarquias e fundações públicas.
O que é autarquia?;Entidade pública com personalidade jurídica própria e fins específicos.
