O que são Relações Internacionais sob o prisma jurídico?;Conjunto de interações entre Estados, organizações internacionais, ONGs, empresas e indivíduos, influenciadas por fatores políticos, econômicos, culturais e militares.
Quais atores participam das Relações Internacionais?;Estados, organizações internacionais, ONGs, empresas e indivíduos.
Quais fatores influenciam as Relações Internacionais?;Política, economia, geopolítica, poder militar, cultura, interesses e necessidades humanas.
Qual é o papel do Direito Internacional Público?;Regular as relações internacionais para garantir convivência e realização de interesses comuns.
O Direito Internacional resolve todos os problemas globais?;"Não, mas também não é inútil; contribui para organizar e orientar as relações."
Por que é necessário compreender fatores além do Direito nas relações internacionais?;Porque as relações internacionais são complexas e influenciadas por fatores políticos e econômicos.
O Direito Internacional existe mesmo quando é descumprido?;Sim, sua existência independe do cumprimento de suas normas.
O Direito Internacional é estático?;Não, ele é influenciado pela dinâmica da sociedade internacional.
Qual a diferença entre Comunidade Internacional e Sociedade Internacional?;"Comunidade baseia-se em laços espontâneos; sociedade baseia-se em vínculos intencionais para objetivos comuns."
Existe consenso sobre a existência de uma comunidade internacional?;Não, há divergências doutrinárias.
Quais são as características da Sociedade Internacional?;Universal, heterogênea, desigual, descentralizada e baseada na coordenação de interesses.
O que significa dizer que a Sociedade Internacional é universal?;Abrange todo o mundo, ainda que com diferentes níveis de integração.
Por que a Sociedade Internacional é considerada heterogênea?;Porque envolve diversos tipos de atores.
O que caracteriza a desigualdade na Sociedade Internacional?;Diferenças de poder entre os Estados.
O que significa descentralização na Sociedade Internacional?;Ausência de um governo mundial e existência de múltiplos centros de poder.
A Sociedade Internacional é regida por subordinação?;Não, pela coordenação de interesses.
O que é globalização?;Processo de integração econômica, política, social e cultural entre países.
Quais momentos históricos marcaram a globalização?;Grandes Navegações, Revolução Industrial e fim da Guerra Fria.
O que intensificou a globalização contemporânea?;Avanços da Tecnologia da Informação e Comunicação (TIC).
Quais valores se expandiram com a globalização?;Estado Democrático de Direito e economia de mercado.
Quais são características da globalização atual?;Aumento do comércio, interdependência, blocos regionais, redefinição da soberania.
O termo globalização tem sido questionado?;Sim, devido a crises econômicas e preocupações com segurança.
Quais são os reflexos da globalização no Direito Internacional?;Ampliação das normas, uso de soft law e limitação da soberania estatal.
O que é soft law?;Normas internacionais mais flexíveis e não obrigatórias.
Qual é o objeto do Direito Internacional Público?;Reduzir a anarquia, regular cooperação, proteger bens jurídicos e atender interesses comuns.
O que significa reduzir a anarquia internacional?;Diminuir a ausência de autoridade central por meio de normas.
O que é o fundamento do Direito Internacional Público?;A base que explica por que as normas internacionais são obrigatórias.
Quais são as principais correntes sobre o fundamento do DIP?;Voluntarismo e objetivismo.
O que defende o voluntarismo?;Que a obrigatoriedade decorre da vontade dos Estados.
Como os Estados manifestam sua vontade no voluntarismo?;Por consentimento expresso (tratados) ou tácito (costumes).
O que é a teoria da autolimitação da vontade?;O Estado se submete voluntariamente às normas internacionais.
Quem formulou a teoria da vontade coletiva?;Heinrich Triepel.
O que diz a teoria da vontade coletiva?;O Direito Internacional surge da vontade comum dos Estados.
O que é o consentimento das nações?;A maioria dos Estados decide livremente sem necessidade de unanimidade.
O que defende a teoria da delegação do direito interno?;O Direito Internacional deriva do ordenamento jurídico nacional.
O que defende o objetivismo?;Que a obrigatoriedade independe da vontade dos Estados.
O que é o jusnaturalismo?;Corrente que fundamenta o Direito em princípios naturais ou racionais.
O que dizem as teorias sociológicas do Direito?;Que as normas derivam de fatos sociais.
O que é a teoria da norma-base de Kelsen?;O Direito Internacional se fundamenta em uma norma hipotética fundamental.
;
Qual é a principal crítica ao voluntarismo?;Condiciona o Direito Internacional à vontade dos Estados, sujeita a interesses políticos.
Qual é a principal crítica ao objetivismo?;Ignora a vontade dos Estados e pode gerar normas desconectadas dos interesses dos povos.
O que propõe a teoria conciliadora?;Combina elementos do voluntarismo e do objetivismo.
Quem desenvolveu a teoria conciliadora?;Dionísio Anzilotti.
Por que o Direito Internacional é obrigatório segundo Anzilotti?;Porque contém normas essenciais para a sociedade internacional.
A teoria conciliadora ignora a vontade dos Estados?;Não, ela reconhece a importância da vontade estatal.
O que acontece após os Estados aceitarem normas internacionais?;Devem cumpri-las de boa-fé.
O que significa o princípio pacta sunt servanda?;Os acordos devem ser cumpridos de boa-fé.
O que é jus cogens?;Normas imperativas do Direito Internacional que limitam a vontade dos Estados.
Quais críticas negam a existência do Direito Internacional como sistema jurídico?;Alegam que suas normas são morais, falta organização global e não há coercitividade.
Por que alguns negam o caráter jurídico do Direito Internacional?;Pela ausência de autoridade central e força coercitiva.
O Direito Internacional possui coercitividade?;Sim, ainda que de forma descentralizada e limitada.
Qual a diferença entre direito de coordenação e de subordinação?;"O internacional é de coordenação; o interno é de subordinação."
Por que o Direito Internacional é considerado de coordenação?;Porque os Estados negociam as normas entre si.
Como ocorre a produção normativa no Direito Internacional?;De forma descentralizada, por Estados e organizações internacionais.
As normas internacionais são obrigatórias?;Sim, e podem prever sanções.
Existe hierarquia rígida no Direito Internacional?;Não, mas há limitações importantes.
O que limita os tratados internacionais?;O jus cogens.
Normas regionais podem contrariar normas globais?;Não, devem respeitá-las.
O que é a fragmentação do Direito Internacional?;A existência de múltiplas áreas especializadas dentro do sistema.
Quais áreas exemplificam a fragmentação do Direito Internacional?;Direitos humanos, trabalho e meio ambiente.
O Direito Internacional influencia o direito interno?;Sim, impacta legislações nacionais.
Como o Protocolo de Quioto afeta os Estados?;Exige redução da poluição, influenciando leis ambientais internas.
O que os tratados de direitos humanos exigem dos Estados?;Garantia de direitos no âmbito interno.
O que o Direito Internacional atual regula principalmente?;A cooperação entre Estados.
Como os Estados eram vistos tradicionalmente?;Como soberanos e independentes.
Por que a cooperação internacional é necessária?;Porque problemas globais afetam vários países simultaneamente.
Cite problemas que exigem cooperação internacional.;Poluição, desastres naturais, conflitos armados e práticas trabalhistas desleais.
A cooperação internacional serve apenas para resolver problemas?;Não, também promove desenvolvimento e regula áreas globais.
Quais áreas globais são reguladas pela cooperação internacional?;Alto-mar e espaço extraatmosférico.
Como os Estados realizam cooperação internacional?;Por meio de tratados e organizações internacionais.
O que é o Tratado de Não Proliferação Nuclear (TNP)?;Acordo internacional para evitar a disseminação de armas nucleares.
Qual é a função da AIEA?;Fiscalizar o cumprimento do TNP.
Quando a cooperação internacional se tornou essencial?;No século XX.
Para quais áreas o Direito Internacional se expandiu?;Direitos humanos, meio ambiente, crime transnacional, cultura, ciência e esporte.
O que é jurisdição internacional?;Mecanismos para aplicar normas internacionais.
Existe governo central na sociedade internacional?;Não.
Por que os Estados limitam interferências externas?;Para preservar sua soberania.
Que tipos de órgãos aplicam o Direito Internacional?;Judiciais, arbitrais e administrativos.
O que fazem os órgãos judiciais internacionais?;Julgam disputas e aplicam normas.
O que é a Corte Internacional de Justiça (CIJ)?;Tribunal que resolve disputas entre Estados.
O que é o Tribunal Penal Internacional (TPI)?;Julga indivíduos por crimes contra a humanidade.
O que é o Tribunal Permanente de Revisão do MERCOSUL?;Tribunal regional para solução de controvérsias no bloco.
O que faz o Comitê CEDAW?;Monitora o cumprimento de tratados sobre discriminação contra a mulher.
Os Estados são automaticamente submetidos a tribunais internacionais?;Não, precisam aceitar a jurisdição.
Tribunais internacionais podem julgar indivíduos?;Sim, em alguns casos.
Qual tribunal permite que indivíduos processem Estados europeus?;Corte Europeia de Direitos Humanos.
Qual órgão recebe petições individuais nas Américas?;Comissão Interamericana de Direitos Humanos.
;
;
O Direito Internacional prevê sanções?;Sim, prevê sanções para violações das normas internacionais.
Por que a aplicação de sanções internacionais é difícil?;Pela falta de órgão central, dependência dos Estados e atuação baseada em interesses próprios.
Qual é um obstáculo estrutural à aplicação de sanções internacionais?;A ausência de uma autoridade central global.
Como os interesses dos Estados afetam a aplicação de sanções?;Podem dificultar ou impedir sua aplicação conforme conveniências políticas.
Cite exemplos de sanções no Direito Internacional.;Envio de tropas, expulsão de diplomatas, reparações financeiras e retaliações comerciais.
O que é persona non grata?;Declaração que obriga a retirada de um diplomata do país.
O envio de tropas da ONU é considerado sanção?;Sim, em contextos de manutenção da paz e segurança internacional.
O que ocorre quando normas internacionais são incorporadas ao direito interno?;Podem ser aplicadas sanções nacionais.
As sanções reforçam qual característica do Direito Internacional?;Seu caráter jurídico.
O que é o Direito Internacional Público (DIP)?;Ramo que regula relações entre Estados e outros atores internacionais.
Qual é o objetivo do DIP?;Promover cooperação e proteger valores como paz e direitos humanos.
Como são estabelecidas as normas do DIP?;Por tratados e convenções internacionais.
O DIP tem aplicação apenas externa?;Não, também pode ter efeitos internos.
O DIP pode ser fiscalizado?;Sim, por órgãos internacionais.
O que é o Direito Internacional Privado (DIPRI)?;Ramo que regula conflitos de leis no espaço.
Em que situações se aplica o DIPRI?;Em relações privadas com elemento internacional.
Quem estabelece as normas do DIPRI?;Principalmente os Estados, podendo haver tratados.
O DIPRI regula diretamente relações?;Não, apenas indica qual lei aplicar.
Quem controla a aplicação do DIPRI?;O Judiciário nacional.
Qual exemplo de caso típico do DIPRI?;Casamento internacional com múltiplas jurisdições.
Outro exemplo de DIPRI?;Sucessão de bens em diferentes países.
Qual a principal diferença entre DIP e DIPRI?;"DIP regula relações internacionais; DIPRI regula conflitos de leis."
As normas do DIP são de que tipo?;De aplicação direta.
As normas do DIPRI são de que tipo?;Normas indicativas do direito aplicável.
De onde vêm as normas do DIP?;Do Direito Internacional.
De onde vêm as normas do DIPRI?;Do Direito interno e internacional.
O Direito Internacional influencia o direito interno?;Sim, diretamente.
Como ocorre a incorporação de normas internacionais no Brasil?;Por meio de procedimento definido na Constituição.
Podem ocorrer conflitos entre normas internas e internacionais?;Sim.
O que defende o dualismo?;Que Direito Internacional e interno são sistemas separados.
No dualismo, normas internacionais têm efeito automático?;Não, precisam de incorporação.
Quem são autores do dualismo?;Heinrich Triepel e Dionísio Anzilotti.
O Brasil adota qual forma de dualismo?;Dualismo moderado.
O que defende o monismo?;Que há uma única ordem jurídica.
No monismo, normas internacionais precisam de incorporação?;Não necessariamente.
O que é monismo internacionalista?;Primazia do Direito Internacional sobre o interno.
Quem defendeu o monismo internacionalista?;Hans Kelsen.
O que é monismo nacionalista?;Primazia do Direito interno sobre o internacional.
Quem associou-se ao monismo nacionalista?;Hegel.
Qual modelo o Direito Internacional adota em geral?;Monismo internacionalista.
Qual documento consagra o monismo internacionalista?;Convenção de Viena de 1969.
Como é o modelo brasileiro na prática?;Mistura de dualismo moderado e monismo nacionalista.
Normas internacionais podem prevalecer sobre leis internas no Brasil?;Sim.
Normas internacionais podem ter status constitucional no Brasil?;Sim, em casos específicos.
O que caracteriza o dualismo?;Duas ordens jurídicas independentes.
No dualismo, há conflito entre normas?;Não, pois são sistemas separados.
O que é necessário no dualismo para validade interna?;Incorporação por norma interna.
O que caracteriza o monismo?;Existência de uma única ordem jurídica.
No monismo, pode haver conflito entre normas?;Sim.
No monismo, é necessária incorporação formal?;Não obrigatoriamente.
;
;
O que caracteriza o dualismo radical?;Exige que o conteúdo dos tratados seja incorporado ao direito interno por lei.
O que caracteriza o dualismo moderado?;Exige apenas ratificação pelo chefe de Estado com aprovação prévia do Parlamento.
Qual a diferença central entre dualismo radical e moderado?;"O radical exige lei interna; o moderado exige apenas ratificação com aprovação parlamentar."
O que é monismo internacionalista?;Teoria que afirma a primazia do Direito Internacional sobre o direito interno.
O que é monismo nacionalista?;Teoria que afirma a primazia do direito interno sobre o Direito Internacional.
Qual teoria é adotada pelo próprio Direito Internacional?;Monismo internacionalista.
O monismo nacionalista ainda é aplicado?;Sim, por diversos Estados.
O que é monismo internacionalista radical?;Tratados prevalecem sobre todo o direito interno, inclusive a Constituição.
O que ocorre com normas internas no monismo internacionalista radical?;Podem ser declaradas inválidas se contrárias ao Direito Internacional.
O que é monismo internacionalista moderado?;Tratados prevalecem, mas o direito interno pode ser aplicado em certas situações.
No monismo internacionalista moderado, normas internas podem ser inválidas?;"Nem sempre; podem ser aplicadas com responsabilização internacional do Estado."
O que caracteriza o dualismo em geral?;Existência de duas ordens jurídicas independentes: interna e internacional.
No dualismo, há conflito entre normas internas e internacionais?;Não, pois pertencem a sistemas distintos.
O que é necessário no dualismo para validade interna de normas internacionais?;Incorporação por norma interna.
O que caracteriza o monismo em geral?;Existência de uma única ordem jurídica com normas internas e internacionais.
No monismo, pode haver conflito entre normas?;Sim.
Normas internacionais precisam de incorporação no monismo?;Não necessariamente.
Quais são os tipos de dualismo?;Dualismo radical e dualismo moderado.
Quais são os tipos de monismo?;Monismo internacionalista e monismo nacionalista.
O que diferencia o monismo internacionalista do nacionalista?;A primazia: internacional vs. interna.
Quais são as variações do monismo internacionalista?;Radical e moderado.
O que estabelece o princípio da primazia da norma mais favorável?;Prevalece a norma que melhor protege a dignidade humana.
Em que área esse princípio é mais aplicado?;No Direito Internacional dos Direitos Humanos.
Qual é o fundamento do princípio da norma mais favorável?;A proteção da pessoa humana como valor superior.
O que são fontes do Direito Internacional?;Origem e forma de manifestação das normas jurídicas.
Qual a diferença entre fontes materiais e formais?;"Materiais explicam a origem; formais expressam as normas."
O que são fontes materiais do Direito Internacional?;Fatores que levam ao surgimento das normas.
Dê exemplo de fonte material.;A Segunda Guerra Mundial influenciando normas de direitos humanos.
Quais elementos compõem as fontes materiais?;Fatores sociológicos, políticos, filosóficos e econômicos.
O que são fontes formais do Direito Internacional?;Formas de exteriorização das normas jurídicas.
As fontes formais pertencem a que tipo de direito?;Direito positivo.
Quais são exemplos de fontes formais?;Tratados, costumes e princípios gerais do Direito.
;
O que são fontes formais do Direito Internacional?;Formas de expressão e exteriorização das normas jurídicas internacionais.
Onde estão previstas as fontes estatutárias do Direito Internacional?;No artigo 38 do Estatuto da Corte Internacional de Justiça (CIJ).
Quais são as fontes estatutárias do Direito Internacional?;Tratados, costume internacional, princípios gerais do direito, jurisprudência e doutrina, e equidade.
O que são tratados internacionais?;Acordos escritos entre Estados que estabelecem regras obrigatórias entre as partes.
O que é costume internacional?;Prática geral aceita como juridicamente obrigatória.
O que são princípios gerais do direito?;Regras fundamentais reconhecidas pelas nações civilizadas.
Qual o papel da jurisprudência no Direito Internacional?;Servir como meio auxiliar para interpretação das normas.
Qual o papel da doutrina no Direito Internacional?;Auxiliar na compreensão e aplicação do Direito por meio de estudos de juristas.
O que é equidade (ex aequo et bono)?;Aplicação da justiça com base na equidade, se houver concordância das partes.
Existe hierarquia entre as fontes do Direito Internacional?;Não há hierarquia formal estabelecida pelo Estatuto da CIJ.
Qual é a visão dominante sobre hierarquia entre fontes?;Não há hierarquia fixa, mas tratados têm maior relevância prática.
O que são fontes extraestatutárias?;Fontes não previstas no artigo 38 do Estatuto da CIJ.
Cite exemplos de fontes extraestatutárias.;Princípios gerais do DIP, atos unilaterais, decisões de organizações internacionais, soft law, jus cogens.
O que são atos unilaterais dos Estados?;Declarações feitas por Estados que podem gerar obrigações jurídicas.
O que são decisões de organizações internacionais?;Resoluções e regulamentos que influenciam ou vinculam Estados.
O que é soft law?;Normas não vinculantes que influenciam a prática internacional.
O que é jus cogens como fonte?;Normas imperativas aceitas pela comunidade internacional.
Contratos internacionais são fonte do DIP?;Não, são fontes do Direito Internacional Privado.
O que é lex mercatoria?;Conjunto de normas comerciais internacionais, ligado ao Direito Internacional Privado.
Quais são as fontes principais do Direito Internacional?;Tratados, costume e princípios gerais do direito.
O que caracteriza uma fonte principal?;Revela diretamente o direito aplicável.
Quais são as fontes acessórias?;Jurisprudência e doutrina.
Qual a função das fontes acessórias?;Auxiliar na interpretação e aplicação das normas.
O que são fontes convencionais?;Resultam do acordo de vontades entre sujeitos de Direito Internacional.
Cite exemplos de fontes convencionais.;Tratados e, para parte da doutrina, o costume.
O que são fontes não convencionais?;Decorrem da evolução da realidade internacional.
Cite exemplos de fontes não convencionais.;Jus cogens, jurisprudência, atos unilaterais, decisões de organizações internacionais.
O costume pode ser fonte convencional ou não convencional?;Sim, depende da corrente doutrinária.
O que são fontes estatutárias?;As previstas no artigo 38 do Estatuto da CIJ.
Cite fontes estatutárias.;Tratados, costume, princípios gerais, jurisprudência e doutrina.
O que são fontes extraestatutárias?;Fontes não previstas no artigo 38.
Cite fontes extraestatutárias.;Atos unilaterais, soft law, decisões de organizações internacionais.
O que são tratados no Direito Internacional?;Acordos escritos entre Estados e organizações internacionais.
Qual a importância histórica dos tratados?;Tornaram-se a principal fonte após a Paz de Vestfália.
;
;
O que é costume internacional?;Prática geral, uniforme e reiterada, reconhecida como juridicamente obrigatória.
Quais são os elementos essenciais do costume internacional?;Elemento material (prática) e elemento psicológico (opinio juris).
O que é o elemento material do costume?;Prática generalizada, reiterada e uniforme nas relações internacionais.
O que significa inveterata consuetudo?;Conteúdo da prática reiterada que forma o costume.
O que é o elemento psicológico do costume?;Convicção de que a prática é juridicamente obrigatória (opinio juris).
O costume internacional exige unanimidade?;Não, basta aceitação por grupo amplo e representativo.
O costume internacional pode ser regional?;Sim, pode ser regional ou até bilateral.
Qual a visão voluntarista sobre o costume?;É fruto de acordo tácito e só obriga quem o aceita.
Qual a visão objetivista sobre o costume?;Obriga todos (erga omnes), independentemente de aceitação.
O que é um objetor persistente?;Estado que rejeita expressamente o costume desde o início.
O que é um objetor subsequente?;Estado que deixa de aceitar um costume anteriormente reconhecido.
Quem tem o ônus da prova do costume?;Quem invoca a norma costumeira.
Como o costume internacional pode ser extinto?;Por desuso, substituição ou codificação.
O que é desuso no costume internacional?;Quando a prática deixa de ser reiterada e perde obrigatoriedade.
O que é substituição de costume?;Quando nova prática se torna predominante.
O que é codificação do costume?;Incorporação do costume em tratados internacionais.
O costume ainda é relevante hoje?;Sim, especialmente em áreas específicas do Direito Internacional.
Cite áreas em que o costume ainda é essencial.;Imunidade de jurisdição, reciprocidade e interpretação de tratados.
O costume precisa ser incorporado formalmente no Brasil?;Não, tem aplicação direta.
O que é jurisprudência internacional?;Conjunto de decisões judiciais reiteradas sobre temas semelhantes.
Quem produz a jurisprudência internacional?;Tribunais e órgãos jurisdicionais internacionais.
Cite exemplos de cortes internacionais.;Corte Internacional de Justiça, Tribunal Penal Internacional e Corte Interamericana de Direitos Humanos.
Órgãos não judiciais influenciam a jurisprudência?;Sim, como comissões e tribunais arbitrais.
A jurisprudência é fonte principal do Direito Internacional?;Não, é fonte auxiliar.
A jurisprudência cria normas jurídicas?;Não, apenas interpreta o Direito existente.
As decisões da CIJ são obrigatórias para todos os Estados?;Não, apenas para as partes envolvidas no caso.
Decisões judiciais influenciam julgamentos futuros?;Sim, servem como referência.
O Direito Internacional influencia decisões nacionais?;Sim, inclusive no Brasil.
O que é doutrina no Direito Internacional?;Produção intelectual de especialistas sobre o tema.
A doutrina é vinculante?;Não, apenas orienta interpretação e aplicação do Direito.
Qual foi o papel histórico da doutrina?;Ajudou a formar o Direito Internacional.
Qual é o papel atual da doutrina?;Interpretar normas e contribuir para novos princípios.
O que são princípios gerais do Direito?;Normas abstratas que fundamentam sistemas jurídicos.
Qual a função dos princípios gerais?;Orientar criação, interpretação e aplicação das normas.
Cite exemplos de princípios gerais do Direito.;Dignidade humana, boa-fé, pacta sunt servanda, devido processo legal.
O que significa pacta sunt servanda?;Os acordos devem ser cumpridos.
O que é boa-fé no Direito Internacional?;Dever de agir com lealdade e honestidade jurídica.
O que é res judicata?;Coisa julgada, decisão definitiva.
O que significa obrigação de reparar danos?;Dever de compensar prejuízos causados.
Como evoluiu o conceito de princípios gerais?;De “nações civilizadas” para reconhecimento global.
;
O que são princípios gerais do Direito Internacional Público?;Regras que estruturam o Direito Internacional e orientam a atuação de seus sujeitos.
Cite exemplos de princípios gerais do Direito Internacional.;Soberania, não intervenção, igualdade entre Estados, autodeterminação, cooperação e solução pacífica de controvérsias.
O que significa o princípio da soberania nacional?;Cada Estado exerce autoridade sobre seu território sem interferência externa.
O que é o princípio da não intervenção?;Proíbe interferência de um Estado nos assuntos internos de outro.
O que é igualdade jurídica entre Estados?;Todos os Estados são iguais perante o Direito Internacional.
O que é autodeterminação dos povos?;Direito dos povos de decidir seu próprio destino político.
O que é o princípio da cooperação internacional?;Estados devem colaborar para resolver problemas globais.
