Os direitos humanos são prerrogativas que podem ser afastadas conforme a vontade do Estado.;Errado. Os direitos humanos são inerentes e não podem ser afastados, pois são essenciais para a dignidade humana.
A teoria jusnaturalista fundamenta os direitos humanos em uma ordem universal e imutável.;Certo. Essa teoria entende os direitos humanos como direitos naturais, anteriores e superiores à legislação estatal.
A teoria positivista considera direitos humanos apenas aqueles previstos em normas jurídicas.;Certo. Para essa teoria, só são direitos humanos aqueles expressamente previstos no direito positivo.
Os direitos humanos são exclusivos de pessoas com nacionalidade reconhecida.;Errado. Eles são universais e aplicam-se a todos os seres humanos, independentemente da nacionalidade, inclusive apátridas.
A historicidade dos direitos humanos permite o retrocesso em normas já positivadas.;Errado. Vigora o princípio da proibição do retrocesso, ou seja, normas de direitos humanos não podem ter sua proteção reduzida.
Direitos humanos são imprescritíveis, ou seja, não perdem validade com o passar do tempo.;Certo. Embora haja resistência em alguns países, a doutrina e jurisprudência internacional consideram os direitos humanos imprescritíveis.
A dignidade humana é um dos fundamentos atuais para os direitos humanos.;Certo. A dignidade inerente a todos é base para reconhecer direitos humanos como universais e iguais.
A proteção dos direitos humanos é obrigação exclusiva do Estado.;Errado. Além do Estado, também cabe a entes privados respeitar e promover os direitos humanos.
Os direitos humanos são inalienáveis, ou seja, podem ser vendidos ou transferidos entre pessoas.;Errado. São inalienáveis, o que significa que não podem ser vendidos, transferidos ou renunciados.
A positivação dos direitos humanos pode ajudar a assegurar melhor sua proteção.;Certo. Apesar de não ser o fundamento essencial, a positivação nas leis facilita a proteção jurídica dos direitos humanos.
Os direitos humanos são divisíveis e independentes entre si, podendo ser aplicados isoladamente.;Errado. Os direitos humanos são indivisíveis, interdependentes e complementares, ou seja, dependem uns dos outros para sua realização plena.
A existência de tratados diferentes para direitos civis e políticos e para direitos econômicos não contradiz a indivisibilidade dos direitos humanos.;Certo. Embora estejam em tratados distintos, a doutrina mantém que os direitos humanos são indivisíveis e interdependentes.
O princípio da norma mais favorável determina que, diante do conflito entre duas normas de direitos humanos, deve ser aplicada a que menos protege a dignidade humana.;Errado. Deve ser aplicada a norma que melhor proteja a dignidade humana, garantindo a maior proteção possível ao indivíduo (princípio pro homine).
O princípio da norma mais favorável está previsto no artigo 5° do Pacto dos Direitos Civis e Políticos.;Certo. O artigo 5° desse pacto determina que nenhuma disposição pode limitar os direitos reconhecidos no pacto além do que está previsto nele, reforçando a proteção máxima dos direitos.
Um direito humano pode ser limitado para eliminar totalmente outro direito humano.;Errado. Direitos podem ser limitados para evitar a eliminação total de outro direito, protegendo o direito alheio e a ordem pública, sempre com base em proporcionalidade e razoabilidade.
As listas de fatores de discriminação nas normas de direitos humanos são exaustivas, não admitindo outros motivos de discriminação.;Errado. As listas não são exaustivas, e discriminações motivadas por outros fatores não previstos explicitamente, como origem regional, são igualmente ilícitas.
A transnacionalidade dos direitos humanos significa que eles pertencem às pessoas independentemente de sua nacionalidade ou condição de apátrida.;Certo. Essa é uma característica essencial dos direitos humanos, que transcendem fronteiras nacionais.
A historicidade permite que normas de direitos humanos sejam eliminadas ou reduzidas em seu escopo de proteção.;Errado. A historicidade permite avanços na inclusão de direitos, mas há o princípio da proibição do retrocesso, que impede a redução da proteção já conquistada.
A celebração de dois pactos distintos em 1966 para diferentes dimensões dos direitos humanos enfraquece a ideia de sua indivisibilidade.;Errado. Apesar dos pactos distintos, os direitos continuam indivisíveis e interdependentes, conforme reconhecido na doutrina e na Declaração Universal.
O princípio da primazia da norma mais favorável só se aplica a normas internas e não tem respaldo em tratados internacionais.;Errado. Esse princípio está consagrado em tratados internacionais, como o Pacto dos Direitos Civis e Políticos e a Convenção Americana de Direitos Humanos (Pacto de São José).
As fontes materiais dos direitos humanos são os fatos sociais e ideias que formam a convicção da necessidade de proteger valores fundamentais.;Certo. As fontes materiais são os fatos sociais, políticos, filosóficos, religiosos, etc., que motivam a criação dos direitos humanos para proteger valores essenciais à dignidade humana.
2. As fontes formais dos direitos humanos são exclusivamente os tratados internacionais.;Errado. As fontes formais incluem tratados, costumes, jurisprudência internacional, doutrina, resoluções de organizações internacionais e soft law, além das fontes gerais do Direito Internacional Público.
3. Os direitos humanos são parte do jus cogens no Direito Internacional.;Certo. Normas de direitos humanos são consideradas jus cogens, isto é, normas imperativas que não podem ser violadas, reforçando sua importância universal e obrigatória.
4. Os direitos humanos são protegidos apenas em âmbito internacional, não na ordem constitucional dos Estados.;Errado. Os direitos humanos têm sua proteção natural na ordem constitucional interna, onde são chamados de direitos fundamentais e delimitam o exercício do poder estatal.
5. A Magna Carta de 1215 foi importante porque limitou os poderes do monarca inglês e garantiu direitos aos nobres.;Certo. A Magna Carta foi um marco ao limitar o poder absoluto do rei e assegurar direitos como liberdade de locomoção e acesso à justiça para a nobreza.
6. Na Antiguidade, todos os povos já garantiam direitos humanos universais para estrangeiros.;"Errado. Na Antiguidade, os direitos geralmente se aplicavam apenas aos membros do grupo ou cidadão; estrangeiros eram excluídos. A universalidade foi impulsionada principalmente pela doutrina cristã."
7. A doutrina cristã contribuiu para a universalidade dos direitos humanos e proteção especial a grupos vulneráveis.;Certo. A doutrina cristã enfatizou a universalidade dos direitos e atenção especial a órfãos, viúvas, estrangeiros, doentes e mulheres, antecipando sistemas modernos de proteção.
8. A Declaração Universal dos Direitos Humanos de 1948 é um tratado internacional com força vinculante.;Errado. A Declaração é uma resolução da ONU, não um tratado, e não tem força vinculante técnica, mas é a principal referência mundial sobre direitos humanos.
9. O Iluminismo influenciou a limitação do poder estatal e a valorização da pessoa nas revoluções do século XVIII.;Certo. O Iluminismo trouxe o humanismo e ideias que inspiraram a Independência Americana e a Revolução Francesa, destacando a liberdade, igualdade e limitação do poder do Estado.
10. O Direito Humanitário surgiu no século XIX para regulamentar a guerra e proteger as pessoas.;Certo. No século XIX, o Direito Humanitário surgiu para limitar os danos dos conflitos armados à vida humana, sendo a primeira manifestação internacional significativa na proteção dos direitos humanos.
11. A preocupação social com os direitos humanos só surgiu no século XX.;Errado. Já no século XIX houve avanços importantes com a inclusão de direitos sociais e trabalhistas em constituições e o surgimento do Marxismo, que influenciou as melhorias nas condições de vida.
12. Após a Segunda Guerra Mundial, a ONU e a Declaração Universal dos Direitos Humanos passaram a dar prioridade internacional aos direitos humanos.;Certo. A criação da ONU (1945) e a Declaração Universal (1948) marcaram a priorização global da proteção dos direitos humanos na ordem internacional.
13. A ordem constitucional é o lugar natural para consagrar direitos humanos, que são chamados de direitos fundamentais.;Certo. A proteção dos direitos humanos se dá preferencialmente na constituição dos Estados, onde recebem status de direitos fundamentais que limitam o poder estatal.
14. O soft law não tem relação com os direitos humanos no âmbito internacional.;Errado. O soft law é uma fonte importante no direito internacional dos direitos humanos, reunindo normas não vinculantes, mas que orientam a prática e evolução do direito.
A classificação dos direitos humanos em gerações tem valor apenas didático, não hierarquiza a importância dos direitos.;Certo. A classificação serve para fins didáticos, para entender a evolução histórica e características comuns, sem hierarquizar.
Os direitos civis e políticos são chamados direitos de liberdade e pertencem à primeira geração.;Certo. Esses direitos foram os primeiros a serem consagrados, garantindo liberdades individuais e políticas.
Os direitos econômicos, sociais e culturais são direitos que não dependem da ação estatal para sua efetivação.;Errado. Eles exigem a atuação do Estado, como políticas públicas e legislação, para sua concretização.
Os direitos da terceira geração são individuais e aplicáveis somente a grupos sociais específicos.;Errado. São direitos difusos, voltados ao gênero humano como um todo, como o direito ao meio ambiente e à paz.
A doutrina atribui aplicabilidade imediata apenas aos direitos da primeira geração.;Errado. Atualmente, entende-se que direitos das segundas gerações também possuem aplicabilidade imediata e são justiciáveis.
A quarta geração dos direitos humanos inclui o direito à informação e ao pluralismo.;Certo. Segundo Bonavides, essa geração reflete a globalização política e inclui direitos relacionados à democracia e informação.
O direito à paz é considerado o único direito da quinta geração dos direitos humanos.;Certo. Bonavides define a quinta geração tendo a paz como fundamento essencial para a convivência social e política.
A classificação dos direitos humanos em gerações é aceita sem críticas, pois todos surgiram em ordem cronológica.;Errado. Muitos direitos sociais, por exemplo, surgiram simultaneamente ou até antes de certos direitos políticos.
A divisão em gerações permite que alguns direitos sejam considerados menos importantes para a dignidade humana.;Errado. A indivisibilidade dos direitos humanos impede que qualquer direito seja considerado menos importante.
"A expressão ""dimensões"" para classificar os direitos humanos é preferível, pois evita a ideia de substituição entre eles.";"Certo. ""Dimensões"" refletem melhor a complementaridade e interdependência dos direitos."
Os direitos civis são os direitos de liberdade que protegem a personalidade moral e física do indivíduo.;Certo. Jorge Miranda destaca essa proteção essencial dos direitos civis.
A liberdade sindical é um direito econômico que não exige ação estatal para ser aplicado.;Certo. É um direito imediatamente aplicável, pois exige que o Estado e setor privado se abstenham de violá-lo.
A classificação em gerações facilita a justificação de políticas públicas que suprimem direitos econômicos.;Errado. Essa visão fragmentária é criticada por ferir a indivisibilidade dos direitos humanos e deve ser evitada.
Os direitos culturais relacionam-se à identidade e memória de uma sociedade.;Certo. Eles compreendem elementos físicos e espirituais que mantêm a cultura viva.
A OIT foi criada em 1919, antes da consolidação de muitos direitos políticos no âmbito internacional.;Certo. Isso mostra que direitos sociais podem ter surgido antes de certos direitos políticos.
Os direitos humanos, consagrados em normas jurídicas, possuem força vinculante e obrigam o Estado e a sociedade.;Certo. Ao serem positivados em normas jurídicas, os direitos humanos tornam-se obrigatórios para o Estado e todos os membros da sociedade, podendo ensejar sanções em caso de descumprimento.
A constitucionalização dos direitos humanos significa apenas a enunciação formal de princípios, sem aplicabilidade prática.;Errado. Conforme Alexandre de Moraes, a constitucionalização dos direitos humanos representa a plena positivação de direitos, que podem ser exigidos judicialmente, garantindo sua efetiva tutela.
Normas de direitos humanos funcionam apenas como regras específicas, sem influência sobre a interpretação de outras normas.;Errado. As normas de direitos humanos podem ser princípios (mais abstratos) que orientam a aplicação e interpretação do ordenamento jurídico, além de poderem ser regras específicas.
No Brasil, os direitos e garantias fundamentais têm aplicabilidade imediata.;Certo. De acordo com o artigo 5º, §1º da Constituição Federal, os direitos e garantias fundamentais têm aplicabilidade imediata no ordenamento jurídico brasileiro.
Os princípios de direitos humanos atualmente não possuem caráter normativo, servindo apenas como diretrizes.;Errado. Atualmente, não há dúvidas quanto ao caráter normativo dos princípios de direitos humanos, ou seja, eles possuem força obrigatória e não são meras diretrizes abstratas.
A força vinculante dos direitos humanos impede que eles sejam usados como modelo de conduta.;Errado. A força vinculante implica exatamente o contrário: os direitos humanos são modelos de conduta obrigatórios para o Estado e a sociedade.
O Direito Internacional dos Direitos Humanos visa proteger a dignidade humana universalmente, sem distinção.;Certo. Esse ramo do Direito Internacional protege e promove a dignidade de todos os indivíduos, independentemente de nacionalidade ou do país onde estejam.
As normas internacionais de direitos humanos limitam a soberania dos Estados e têm status de jus cogens.;Certo. Essas normas possuem prevalência e caráter imperativo, limitando a soberania nacional, pois são consideradas normas inderrogáveis (jus cogens) na comunidade internacional.
O Direito Internacional dos Direitos Humanos não é parte do Direito Internacional e não se aplica o Direito das Gentes.;Errado. Ele é um ramo do Direito Internacional, e se aplicam a ele alguns institutos do Direito das Gentes, como tratados e costumes internacionais.
A universalidade dos direitos humanos sempre foi uma ideia aceita por todos os povos da Antiguidade.;Errado. Na Antiguidade, geralmente os direitos humanos eram reconhecidos apenas dentro das comunidades próprias, não abrangendo estrangeiros ou povos diferentes.
O Cristianismo foi a primeira doutrina a difundir amplamente a noção de universalidade dos direitos humanos.;Certo. O Cristianismo defendeu a ideia de direitos dirigidos a todos os povos indistintamente, contribuindo para a noção de universalidade dos direitos humanos.
Francisco de Vitória, no século XV, contribuiu para o conceito de intervenção humanitária, autorizando a ação de um povo em outro território para proteger direitos.;Certo. Ele desenvolveu a ideia de ingerência humanitária, que permite a intervenção em território estrangeiro para proteger direitos humanos não respeitados.
O Iluminismo não influenciou o desenvolvimento do Direito Internacional dos Direitos Humanos.;Errado. O Iluminismo foi fundamental para a formação desse ramo, pois difundiu ideias ligadas à proteção da pessoa e à internacionalização dos valores jurídicos comuns.
A internacionalização dos direitos humanos no século XVIII ocorreu principalmente por meio de tratados internacionais.;Errado. A internacionalização deu-se mais pela propagação de ideias nas Constituições e movimentos internos (como a Independência dos EUA e a Revolução Francesa) do que pela criação de tratados internacionais.
A Convenção de Genebra de 1864 foi um dos primeiros tratados internacionais para proteger diretamente a pessoa humana.;Certo. Esse tratado visa proteger feridos e enfermos dos exércitos em campanha, marcando o início do Direito Internacional com foco na proteção individual.
A Liga das Nações, criada em 1919, teve como um de seus objetivos a proteção da pessoa humana.;Certo. A Liga das Nações foi o primeiro organismo internacional a incluir os direitos humanos como tema prioritário.
A Organização Internacional do Trabalho (OIT) surgiu para proteger exclusivamente os direitos civis e políticos dos indivíduos.;Errado. A OIT foi criada para regulamentar e proteger padrões mínimos de trabalho, incluindo direitos sociais, fugindo do individualismo liberal dos direitos civis.
O Direito Humanitário, a Liga das Nações e a OIT são considerados marcos iniciais da internacionalização dos direitos humanos.;Certo. Esses três elementos representam os primeiros passos para a proteção internacional da dignidade humana no Direito Internacional.
A II Guerra Mundial foi um marco para a inclusão dos direitos humanos na agenda internacional.;Certo. Após as atrocidades da guerra, os direitos humanos passaram a ser tema prioritário no Direito Internacional, influenciando a criação de normas e instituições como a ONU.
O Nazismo promovia a ideia de que os direitos humanos deveriam ser universais e iguais para todos.;Errado. O Nazismo defendia a restrição de direitos baseada em raça, negando direitos universais e igualitários.
Antes da II Guerra Mundial, a soberania nacional era considerada praticamente absoluta, impedindo interferências externas.;Certo. O princípio da soberania absoluta protegia os Estados de ações internacionais relativas a violações dos direitos humanos em seu território.
O fim da II Guerra não teve impacto na criação de novas instituições internacionais para proteção dos direitos humanos.;Errado. O fim da guerra resultou na criação da ONU, que passou a dar prioridade à proteção dos direitos humanos e à cooperação internacional.
A Declaração Universal dos Direitos Humanos foi proclamada logo após o fim da II Guerra Mundial, em 1948.;Certo. Ela é o marco inicial do desenvolvimento normativo internacional em direitos humanos e base para diversos tratados posteriores.
O Tribunal Militar Internacional de Nuremberg foi o primeiro tribunal internacional a julgar crimes contra os direitos humanos.;Certo. Criado após a II Guerra, julgou crimes cometidos pelos nazistas e é precursor do atual Tribunal Penal Internacional.
Com a criação da ONU, o tema dos direitos humanos passou a ser tratado apenas como uma questão interna de cada país.;Errado. A ONU estabeleceu a proteção dos direitos humanos como um tema prioritário internacional, ultrapassando o conceito de soberania absoluta.
A cooperação internacional foi vista após a II Guerra como essencial para a paz e proteção dos direitos humanos.;Certo. Os Estados aliados perceberam que o desrespeito aos direitos humanos estava na raiz dos conflitos e que a cooperação internacional era fundamental para a estabilidade global.
A influência do positivismo jurídico fazia com que a dimensão axiológica das normas fosse sempre priorizada antes da II Guerra.;Errado. Antes da guerra, o positivismo exacerbado reduzia ou eliminava a importância dos valores (axiologia) nas normas jurídicas.
A ONU foi criada em 1945 com o objetivo de promover a paz, a segurança internacional e a cooperação entre os povos.;Certo. Além da paz e segurança, a proteção dos direitos humanos tornou-se um dos objetivos centrais da organização.
Os tratados internacionais de direitos humanos só começaram a ser elaborados após a Declaração Universal de 1948.;Certo. A Declaração abriu caminho para a elaboração e assinatura de diversos tratados internacionais voltados à proteção dos direitos humanos.
Após a II Guerra, foram criados órgãos internacionais para fiscalizar a conduta dos Estados em matéria de direitos humanos, mesmo sem o consentimento destes.;Certo. A ONU e seus órgãos passaram a ter poderes para investigar e manifestar-se independentemente da vontade dos Estados membros.
O resgate do valor como elemento relevante na norma jurídica só ocorreu no século XXI.;Errado. Esse resgate iniciou-se logo após a II Guerra Mundial, com a valorização da dimensão axiológica das normas jurídicas no Direito Internacional.
A internacionalização dos direitos humanos começou na Paz de Vestfália, em 1648.;Errado. A Paz de Vestfália marcou o conceito clássico de soberania nacional absoluta, mas a internacionalização dos direitos humanos é um fenômeno recente, especialmente após a II Guerra Mundial e a Guerra Fria.
A relativização da soberania nacional absoluta foi fundamental para o desenvolvimento do Direito Internacional dos Direitos Humanos.;Certo. A ideia de que a soberania não é mais absoluta permitiu que normas internacionais pudessem ser aplicadas internamente, inclusive com fiscalização externa.
Hoje, a soberania nacional impede totalmente a fiscalização internacional sobre direitos humanos nos Estados.;Errado. A soberania é limitada pela obrigação dos Estados garantirem direitos humanos e aceitarem fiscalização internacional sobre sua atuação.
No Direito Internacional clássico, o indivíduo tinha papel central e podia atuar diretamente nos foros internacionais.;Errado. O Direito Internacional era essencialmente interestatal, com pouca ou nenhuma atuação direta do indivíduo.
Atualmente, indivíduos podem apresentar queixas diretamente a órgãos internacionais de direitos humanos, independente da vontade do Estado.;Certo. Existem tratados e órgãos que permitem a atuação direta do indivíduo para denunciar violações, mesmo sem consentimento estatal, desde que cumpridas certas condições.
A aceitação do Estado em participar de um foro internacional é irrelevante para o funcionamento dos mecanismos internacionais de direitos humanos.;Errado. Muitos órgãos internacionais só podem atuar se o Estado aceitar sua competência, como a Corte Interamericana de Direitos Humanos.
O princípio do esgotamento dos recursos internos significa que o indivíduo deve recorrer às instâncias nacionais antes de recorrer a órgãos internacionais.;Certo. Esse é um requisito comum para que as instâncias internacionais possam analisar a denúncia.
Os tratados internacionais de direitos humanos são normas obrigatórias para os Estados que consentem em cumpri-los.;Certo. Assim como outros tratados internacionais, os de direitos humanos possuem natureza jurídica vinculante para os Estados signatários.
O soft law possui caráter vinculante e deve ser cumprido pelos Estados obrigatoriamente.;Errado. Soft law é composto por normas não necessariamente vinculantes, usadas para regulamentar matérias complexas ou sensíveis.
O Estado pode ser responsabilizado internacionalmente por não proteger os direitos humanos de indivíduos sob sua jurisdição.;Certo. A responsabilidade estatal é um dos pilares do Direito Internacional dos Direitos Humanos, podendo responder perante órgãos internacionais e outros Estados.
A uniformização dos sistemas políticos mundiais em moldes democráticos contribuiu para a internacionalização dos direitos humanos.;Certo. A convergência em torno do Estado Democrático de Direito facilitou a aceitação e aplicação das normas internacionais de direitos humanos.
"O conceito de ""padrões jurídicos mínimos"" indica que os direitos humanos são recomendações não obrigatórias para os Estados.";"Errado. Os ""padrões jurídicos mínimos"" são requisitos básicos que os Estados devem respeitar para serem considerados na comunidade internacional civilizada."
A intervenção em assuntos internos do Estado para proteger a dignidade humana é um conceito novo do Direito Internacional.;Certo. A antiga inviolabilidade da soberania foi relativizada, permitindo intervenções em casos de graves violações de direitos humanos.
No sistema internacional atual, apenas os Estados têm legitimidade para pleitear a aplicação dos tratados de direitos humanos.;Errado. Indivíduos também podem, em certas condições, apresentar queixas diretamente a órgãos internacionais, sem depender exclusivamente dos Estados.
Os atos internacionais ainda são incorporados ao ordenamento interno segundo regras estabelecidas por cada Estado.;Certo. A aplicação interna dos tratados depende do sistema jurídico nacional, o que pode dificultar sua efetiva implementação.
O Direito Internacional dos Direitos Humanos se aplica somente a cidadãos dos países signatários.;Errado. A universalidade significa que os direitos humanos se aplicam a todas as pessoas, independentemente da nacionalidade.
"2. A Declaração Universal dos Direitos Humanos foi proclamada em 1948 e usa o termo ""homem"" para toda humanidade.";"Certo. Na época, o termo ""homem"" era usado para referir-se a todas as pessoas, mas hoje se evita essa expressão para maior inclusão."
3. O relativismo cultural defende que os direitos humanos universais são uma imposição da cultura ocidental.;Certo. Essa corrente entende que não há uma moral universal válida para todas as culturas, criticando o universalismo.
4. A Declaração de Viena de 1993 rejeita o universalismo em favor do relativismo cultural.;Errado. A Declaração de Viena reafirma o universalismo, reconhecendo diferenças culturais, mas mantendo o dever de proteger os direitos humanos universalmente.
